"0","不是男足菜，不是女足好，只是想用女足来踩踩男足，女足死活它根本不关注，被人无情打脸"
"0","今日整活系列，兄弟们给我顶上去。准备了优质的模因"
"0","后面那个是漩涡鸣人变身的漩涡鸣子😆老板：妖狐给👴🏻爪巴"
"1","要是这些人不再祸害别人，那我倒是觉得挺好的，基因选择嘛，聪明人活下来，傻得慢慢就消失了"
"1","仇视国男的一般就西方国家和汉奸"
"0","非暴力不合作"
"0","大家好啊我是说的道理"
"0","没有用过这些词"
"1","说起文化输出就是东北文化无敌说起地域歧视就是文艺作品都在抹黑东北薛定谔的文化输出是吧"
"1","不行，臭的，全是浑臭"
"0","很多工厂不招贵州人是真怕了贵州人了。"
"1","你对善良这个词是不是有误解？看看黑的犯罪率再说吧"
"1","北京叫王德彪（外地逼)，上海叫乡下人。"
"0","怎么？我就是这样觉得！"
"0","这样的光荣事迹不论txl还是yxl都该让进这个吧的人知道"
"0","你自己自尊自强谁会不尊重你，何来压迫之说。"
"1","玩玩都不行，隔应😕"
"0","重男轻女是存在的，但那也是因为计划生育导致女生出来不了"
"1","狗咬狗中必须要分清谁咬的第一口？问题难道不是两边都是狗吗🤣"
"1","讲个话一直没人回，好不容易等到一个回话的，点开一看居然是女的"
"0","我去过全国几乎所有的省，而且不是走马观花式的那种，我是平均在每个省都待了两三个月"
"1","答应我，别再用亲溤打窝了"
"1","黑命贵祸害原住民是事实"
"1","多数女的，所以，维小人与女子不可教，古人早料到"
"0","四年后的江西人默默走过，并给你点了个赞"
"1","贵州人表示在浙江贵州人的身份经常感受到来自浙江人的恶意"
"0","😆死道友不死贫道"
"0","事实上留在河南的古汉人才是最多的，去南方的都被同化了"
"1","一看它们又是再到处传染各种各样вирус"
"0","关键是黄精灵是真的摘不到蓝精灵一样多的果子啊"
"1","每个在华黑人都会有3个以上的eg"
"0","支持黄白混血！"
"0","那些八国联军和英法联军的种我一般直接选择无视"
"1","香港也有异曲同工的叫法：“北姑”"
"0","歧视别人就别怪别人骂。斗争都是相互的。"
"0","生下来做个鉴定就好了，不怕一万，就怕万一。怕的就是乌龙做了坏人"
"0","说了一大堆废话"
"0","而我只是对前面的人实话实说而已"
"0","是的，确实需要，没有找一个临时替代一下？"
"1","这是大胸妹，她是个精神茶党"
"0","能跟喷神在这事儿上想到一块儿去也是小老弟我的荣幸😅😅😅"
"1","上海是哪里的人都黑，除了环太湖不黑😅"
"0","好像你能看出来似的，能看出来的是什么样的人我就不用说了。"
"0","这...长得有点儿中性吧？也许是我get不到她的美。"
"0","具体是哪的我不知道，反正我徐州人对安徽挺有好感的"
"1","嘴上没得尖锐湿疹的😅😅😅，说话就是硬气😜"
"0","尤其是那段引用，绝！"
"1","而且，跟她走太近，在圈子里跟着社死"
"1","很多人对上海的刻板印象太严重"
"0","上海土著，反对歧视外地人！但是我们希望，新上海人和老上海人能携起手来，共同传承吴语，勿相互攻击。"
"0","还有陕西呢"
"1","谁压迫你了嘛真是脑子有点铁"
"0","大多数都喜欢皮肤白的女生，你想多了"
"1","世界第二大经济体的年轻女生就这种素质，太悲哀了。"
"0","社会戾气太重，带节奏厉害"
"1","河南井盖新疆切糕这俩算是最初成体系的地域黑了吧，之后就是东北，现在有点往山东来的意思了"
"0","哪个是身高都不对头"
"0","日本人侵略东北要从1895开始算，东北人抵抗日本侵略至少50年"
"0","所以要做到一视同仁，我觉得不可能，但我们还是应该向这方面前进，我觉得应当做到平衡，而不是平等"
"1","对头，主要是黑人，男女不重要"
"1","基佬大多数只会骂一两句就不回，这就是纯种懦夫的表现，赞成？赞成"
"0","有些上海人确实是以说上海话显示优越感"
"0","万分之一，中国就有10几万，99.9%就是几百万。少吗？"
"0","证据列一列，哈哈"
"0","同类，很正常"
"0","上海大概是吴越50%，江淮25%，南方其他20%，北方5%"
"0","脸皮厚点，你就无敌了，我说的脸皮厚点不是贬义词，是一种防御方式，别怕丢人，扔掉面子，"
"1","这不给自己弄个精神病病历都对不起想法"
"1","舔狗龟男，渣男和牧人都该人道毁灭"
"0","牛蛙牛蛙?"
"1","男性需要思想解放，钱都给女的了，她们还不满足。"
"1","我儿子要是说要从良j，我一定打断他的腿"
"1","😓天天骂男人，谁要团结宁"
"1","黑高犯罪率，不是歧视，在世界各地都是如此。引进中国，引进犯罪"
"1","普通女生无罪，有罪的是一开始男扮女装挑起性别对立的键盘侠"
"1","😭黑不溜秋怎么有人喜欢。"
"0","成败在此一举，梭哈。"
"0","在一些网站上。铺天盖地的黄女黑男。但是我翻的手机都翻没电了，也翻不到黑女黄男！"
"0","看到小红书这三个字儿"
"0","固她所愿，与吾何干"
"1","我们爱国人士组团一人口唾沫淹死他！"
"1","请各位新来的反同同志注意！"
"0","这好像是友军吧"
"0","世界上哪有这么多幸好😓"
"1","智商70，数理化动辙0分，但生育率骇人！遍地单亲女人带野黑娃"
"0","有水平的人"
"0","可怕的反社会人格"
"0","太小了，应该换个2000ml的来，意思就是“自己松不能怪别人”，这种怕不是要用?"
"1","胡说八道，我魔都不服，有些人理直气壮的歧视上海竟然自己都没发现😆"
"0","不用理他们，他们就是一群闲人，长舌妇一般喜欢指手画脚别人的人生。"
"1","可以让跪虫族好好看看它们虫爹在面对人类精英足球队根本就没有赢可能性"
"0","她们怎么不要妇联的位置呢"
"1","还用我老婆艾斯德斯的头像宁配?？"
"0","《一无所知》"
"0","还有懦弱的拉黑逃避现实"
"1","4，能担起家庭责任，但长期分居，有同姓好友，有大男子主义和暴力倾向；"
"0","用一张下载的报紧回执单就可以把这只吓得一个月不敢露头"
"0","生在红旗下，长在春风里，人民有信仰，国家有力量。"
"0","风范有什么用，实力才是硬道理"
"1","你让我抱个黑娃说这是我外甥，我没这个脸"
"1","原谅？😆什么🐢楠"
"0","强迫认可的意思是改变别人的想法，不认可就喷。"
"1","太惨了，别在意，那些人都是个der"
"0","别尬黑，那叫three year 吃大饱，什么hungry"
"1","你确定这是美人鱼而不是清道夫？"
"0","你说这几个地方离我大学都挺近"
"1","成都人到处开地图炮的时候，有没有考虑过原因？"
"1","这幕刃就是个xn装s，说的话不明不白，偷换概念，初中没毕业，彩礼就是在物化女性，"
"1","黑东北的广东第一名"
"0","有啥用？每次都能避难成功"
"1","如果中国出现类似于黑人马丁路德金这样的聪明人物，对我们中国汉人和中华民族是最大的灾难后果！！！"
"0","类似于民族矛盾和阶级矛盾的区别，不一样。"
"1","像成都这边就比较开放啊，成都mc事件了解一下，好多都是结婚了的聚众淫秽"
"0","你这是高级黑啊"
"0","男女平等就是个笑话"
"1","你说的造物主是哪个造物主？安拉还是耶和华？还是你们意淫出来的女上帝？"
"1","正常人不会嫁给黑人"
"1","是特别无语，到这东西，牠不一定是亻"
"1","这帖子妙啊！找黑黑的，jn都不接的客你接了！😆😆😆"
"0","要么我发地址你马上来找我不要拖泥带水"
"0","多的七毛五是这个费吧"
"1","极端女权？极端男拳？现在会来说团结了啊？想的挺美的啊！"
"0","我也是，被他们打过"
"1","连动物，他也干过，就是不愿意干黑人"
"0","山东人均也前五"
"0","比我说的到位"
"0","又在玩p图啊，休息一下下吧"
"0","你们的回复都好苍白"
"0","的确是，同性恋真的不应该吹捧"
"1","繁殖批只会一击脱离疯狂亏内他的木琴捏嘻嘻，低能真的是笑哭绝绝子"
"0","这一次已经无需再重复了。"
"0","我记忆中男性明显偏多"
"0","存在也不代表就是正确的，要不然哪来那么多犯罪。。。"
"0","与时俱进嘛，成长了"
"0","对呀我说的是一部分人，我也相信存在的那部分是少数"
"1","看到黑人吧三观这么正我就放心了"
"1","姆蛆好恶心?"
"1","支持顺便我想当个小吧把他绞杀"
"0","侦测到在途的聚变打击"
"1","美国嘿人马丁路德金嫖娼考第一"
"0","上海朱家角中非混血"
"1","都是四川人出来黑别人好吗"
"0","怎么回事呢？😐😐"
"1","原始人的习性"
"0","自己才能拯救自己，社会就是这样，不努力是不行的"
"0","让我看看你长啥样"
"1","广西不也被黑得很惨吗"
"0","所以美国等于全世界？"
"0","看过视频，这个华裔警察什么也没做吧，怎么被判刑了"
"1","和黑人睡不恶心吗🤔"
"0","强制复习惹"
"0","实话实说而已"
"1","不不不 我们云南人可比黑种好看多了🤔"
"1","不，我觉得，非我族类，其心必异"
"1","我做不了吧主。坚定反黑。"
"1","万一结婚了，想想身边的人被默默默默三通过，弄不好还有艾滋，整个人都不好了！"
"1","以怂为借口想用视频截别人照片只不过呢没人像你这么🐯"
"1","乐了 自己吃饭都是问题还老想着血统 那群人脑子里可能装的是💩"
"0","也许是我太阴暗了..."
"0","尝试以团结解决一切矛盾，将自己的性别认知为阿帕奇武装直升机，拜托，性别是阿帕奇武装直升机很酷的"
"0","绷不住了?"
"1","这黑人对好人韩德君犯规，还在中国勾搭女孩，好像还生子？"
"0","嫁个能发动全网媒体辟谣的男人"
"0","🤔你做过调查还是深有体会？"
"1","别自我意识过剩了。别人看你也一样hui气。"
"1","江苏那帮是真没家教"
"0","哈哈哈哈。好搞笑🤣"
"0","你真是他的确诊医生？"
"1","连这个是转发贴都看不出来只要有人骂他他就说人家是基佬嘞"
"0","还是说清楚好，你会有别的念头对她，以后也会有别的女人以同样的理由对你"
"1","可是，现在大部分女性不都说要求不婚检吗，婚检就是对我的不信任⁉"
"1","这有什么好讨论的，不怕得艾滋病的接盘就是了"
"0","yysy美国婚后财产分配更离谱"
"1","现在越是风况的P图，越说明它被发现感染Hiv后气急败坏"
"0","记住，人人生而平等，你歧视别人的时候自己已经堕落了"
"1","事实上，现在少了很多，但依然有。比如某电子厂招人，招聘广告里第一行最大五个字，不招河南人。😅"
"0","准备放生大海，希望功德无量"
"1","第二个是豆瓣母拳"
"1","女士优先绅士风度这些是从西方传进来的东西，男女平等才是国策，西方紫苯滋养了女拳"
"1","一个垫步侧踢踢废这些幕刃"
"1","你说得挺对，但也很废话。你看现在反嘿的哪个有权力？你有权力吗？现在就是真正有权力的还助邹为虐"
"0","资本主义的喉舌又来鼓吹消费主义了。"
"1","不会真有人想和小仙女结婚吧不会吧不会吧"
"0","援建不是打工"
"1","可怕的是找了黑人，黑人跑了黑孩留下来了，更可怕的是感染了艾滋，又找中国男人"
"0","这视乎是个没有解药的毒，最有效的就只能是转移"
"1","喜猪妹狂喜"
"1","吧友们帮我骂个慕女狗，打女拳的狗男硬是想被幕刃当狗玩，真丢脸"
"1","违背自然规律道德伦理的还是人吗？好像是人，因为动物很少有搞基的"
"0","禁止倒垃圾"
"0","虽然小时候经常做坏事但是我现在已经是一个正人君子了，善良又可爱，就让往事随风吧"
"0","中国好像临夏宁夏生育率高"
"0","为啥要救回来？"
"0","b吧有啥用啊，发2贴都没了"
"0","这个世界上哪个国家是被全世界歧视的?"
"0","再想想每个大学都有几个到几十个不等😱"
"0","劝你从良把图删了"
"0","边际递减效应？"
"0","跟你有关系吗"
"0","老外都看明白了"
"0","把被删的老文私聊给我一份"
"1","不区分，不和作的，爱占便宜的女性玩。很简单啊，看说话方式就很好区分了"
"1","看起来那就是一个垃圾勾八营销号。"
"1","崇拜黑人的跪族男孩至少不给黑人生猴子的吧？😢"
"0","拿史料证明就行"
"1","顶啊！低等的黑杂种！滚出中国！"
"0","哈哈哈哈……我也是……太逗来……感觉说撒都会被歧视……"
"1","反同乃大势所趋"
"0","你想穿穿呗"
"0","北欧三国是怎么积累财富的？"
"1","必须对黑蛆实施种族灭绝！！！"
"0","😅😅😅至于这么强吹吗？"
"0","南京冯齐海是大学老师呢🤭"
"0","我不接受 而已 我凭啥要消灭人家？？"
"1","放火化炉里烧了吧，埋了都污染土壤"
"0","可惜亚裔不会反抗，也不团结，要不然不会演变成如今的局面"
"0","😅咱们是没特点"
"1","你会发现在中国的混血娃的爸爸基本都是中国人，嫁给外国人的女的都去国外生活了，这就尴尬了😅"
"1","你们基佬要人觉得你们基佬是有素质教养，你们基佬就应该阻止某个基佬让基佬们丢脸的事情否则就是同流合污"
"1","真双标，别的医生的说法你们就不认同吗？"
"1","整天喷光棍，奇趣蛋确实没人要，有钱夜夜当新郎"
"1","说的真好，我就喜欢看你们离婚，看到你们婚姻不幸福，我就很开心"
"1","同的智商低人尽皆知"
"0","上海人在上海为什么不能说上海话？"
"0","哈哈哈，看到我保存的截图了"
"1","直接不接女单就好了，吊事那么多"
"0","属于消失的过去了，现在的话是 社死"
"1","你去撒哈拉以南待两年就不会说这种话了"
"1","锅钕又装男的自我高潮了😅"
"0","有点恐怖啊！"
"1","中专毕业的吧？选项设置的乱七八糟。"
"0","同胞同胞，就是他在外面干了什么“好事”，你没干的承担后果。"
"0","如果女性生孩子是应该的，男性保护女性也是应该的，就别扯那么多不平等了"
"1","那不一样，女的基本上没国家概念，男的是娶，女的是嫁"
"1","女拳都是自私的逐利者。她们为了获取利益，打起拳来可以无视性别。"
"0","一个大家都知道的事情."
"0","男性应该打HPV疫苗吗？"
"1","我昨天看见少儿频道都有两个黑人小孩拿球的画面，你说呢"
"0","听完他的回答，我他娘竟然有相同的想法，看来男同胞的价值观都差不多……"
"0","坦率说，能来中国留学的非洲学生都非常聪明，我这个室友单亲家庭出生，心理是有一定问题的。"
"1","女拳现在泛滥了，敌我难分"
"0","小心点，平平安安的回来。"
"1","谈恋爱，结婚，最拉低男人生活质量"
"0","JATOO也是食神，，，"
"0","战争中死的最多的就是男性，获胜受益的却不仅仅是男性"
"1","这没什么吧，她只要没做什么奇葩事，说什么奇葩话。就不该被攻击。除非你有大病。"
"0","那是必然是冬天最冷夏天最热的南方某省啊，卖惨谁也比不过"
"1","要不要一起组队猎杀默和easygirl"
"1","加两个0吧，一百万小仙女几个月就花完了"
"1","得了便宜还卖乖，贼喊捉贼"
"1","黑人智力≥70，沃森诚不欺我！"
"1","黑就算了，还长得那么猥琐。不知女生喜欢他们什么？"
"0","目前是在征求意见~"
"1","现在什么妖魔鬼怪都能出cos了吗"
"1","看到默我都躲得远远的，这些人真恶心"
"0","这位警官是尽职尽责的人，打爆?"
"0","悟空兽进化钢铁悟空兽珍贵素材"
"0","你想穿没人管你啊，没人干涉你的"
"1","别去宣扬txl跳脚没人管你。"
"1","人人平等，人和冻物怎么能平等呢"
"1","不，我只看到西安的满满敌意，并且莫名其妙。现在连带着对陕西没有一点好感"
"1","当男人崇拜女人时，女人鄙视男人当男人用女人取乐时，女人反而崇拜男人亲身体会"
"1","说重点，艾滋病，要你命"
"1","可以接受男男的存在，但是不要出来恶心我"
"0","啥恶心的人 我想听😓"
"1","如果黑人搞过的女人骗炮呢"
"1","聪明的已经留种跑路了。而愚笨的还在接盘养别人的孩。"
"0","黑人在中国生的混血儿越多而且都是中国籍会怎样？"
"0","满屏都是Mua~Mua~~"
"1","还有好多是玩的。把人弄怀孕了，提上裤子就跑路。这种就叫“华垃圾”"
"0","这个游戏只有国区才有吗港区搜不到"
"0","这个可以有"
"0","就是现在800块一晚上找小姐觉得很值，但是给女朋友买礼物舍不得怎么回事？"
"1","哭她娘滴个鄙！宁可留下猫，把这小表砸一刀一刀宰了"
"0","這句話😅⋯⋯⋯太精闢了"
"1","不一定只有男同恶心。有的阴阳人也挺恶心的😄"
"1","暖男更受欢迎，男性需要改变择偶观?原来的舔狗龟男接盘侠不够用了，赶紧培养一批新的好让我们吸血?"
"1","妈的。。这转发动态比我转发空间都勤快"
"0","应该立法禁止瘾君子进入中国"
"1","在现实中唯唯诺诺，在网络中像圣母一样支持黑人"
"0","我也是服了这个学校了，硬生生的成就了2019年骂人最狠的一句话。"
"0","你考多少呀😊😊😊"
"0","父母不再逼，邻居不再指指点点"
"0","留学生院招“翻译”的时候都排长队，我班女生因为没被选上还闷闷不乐。"
"0","他还想用激将法套我的信息，可惜我已经不上当惹"
"0","清朝吗？男女都不该带吧，虽然说一开始发明是男性为了限制女性，但是时代变了"
"0","真没人黑天津吧🤔"
"0","这老头说的有理有据，支持！"
"1","有些幕刃真的是。。。。"
"0","好吃的炸鸡"
"0","不好意思，不喜欢篮球😄"
"1","默默太恶心了，受不了😱"
"0","黑龙江GDP确实比不过辽宁，我不是东北的，客观看法"
"0","我:你礼貌吗？"
"1","反接盘联盟扫黑除恶，扫黄打非"
"1","干得漂亮，歧视的就是你，咋地啦"
"0","有没有一种可能，所谓的平"
"0","可以不接受 但是不可以骂人 尊重别人是在庄严自己"
"1","除去巫山不是云，习惯了xxl就不合适M码了"
"0","这不有人认为十万不算多，还要加大补贴的发放么，问题来了，谁引进的，谁发钱的"
"0","什么时候给我p一个"
"1","我只知道你是一个无知且无畏的复读机"
"0","😲反抗死的还是无辜死的"
"0","双标男，见的没几个，女的倒是挺多的😆"
"1","普信奇趣蛋也就能想想了"
"0","网络由于其匿名性可以放大人的恶念🙂"
"1","真是龟男、跪男、鬼男。没有男人的血性。"
"1","苏南浙北还能算闺蜜上海可不能说是闺蜜了，那是爹"
"1","陕西没有存在感，一边凉快去"
"0","我认识的河南朋友都挺好的"
"0","黑龙江最穷？我一直的感官是东三省吉林最穷"
"1","脑子多少有点问题"
"1","苍蝇不叮无缝蛋，自食恶果。"
"0","二次元喜欢曹木琴"
"0","《泊秦淮》作者：杜牧烟笼寒水月笼沙，夜泊秦淮近酒家。商女不知亡国恨，隔江犹唱后庭花。"
"0","黑市就能买到，有钱就行就是价格比较贵，要找很久，世界上还是有阴暗面的"
"1","老家浙江的我哪敢说 说了就是明明是我们歧视外地人😆"
"0","人才，好图"
"1","白人欺负黑人,要发声。黑人欺负黄种人，沉默"
"0","想多了兄弟，爱谁接谁接"
"0","那个好像是北京的🤣"
"1","胡人的羊不用偷井盖了吗🤭"
"1","原来是上边某些人，养黑护黑欢迎黑人，怎么办？"
"0","奴隶主是吧??"
"1","少了，以前看新闻一黑人，污染过一百多个女的，警察问他，他说要解决生理需求，又有女的玩，干嘛不玩？"
"1","有些女的就喜欢玩新鲜感，认为外国男比郭楠好，墨人有劲还带艾滋，没办法部分女人喜欢😅😅"
"1","说得好，为了防止西式政治正确绑架科学，需要从我们做起"
"0","这个不是出租车"
"1","可能这样还比拳师好看点吧"
"0","因为你上赶着"
"0","一个亿的十分之一是一千万，百分之一是一百万，千分之一是十万，万分之一是一万"
"0","送动物园或回归自然才是对它最大的爱"
"0","阿，是的是的没错"
"0","没有申请通道"
"0","😅笑死，能给我瑞典绿卡吗"
"0","能够拥有一位贤良淑德的妻子，真是让人羡慕"
"1","千万不要找大龄，尤其是从大城市回来的大龄剩女"
"0","阿肘真是战神啊，牛"
"1","黄河水洗的黄皮肤 5000年都没变的颜色别再过几百年全黑了"
"0","这个emoji有啥关系？"
"1","黑人犯罪率极高"
"0","广西不算什么吧 比起上面这几个"
"0","是，布局了"
"0","每个国家每个民族都有那么几个有病的人，但她们不能代表全部"
"1","洋人真高贵，放个屁都是对的，你是站不起来了"
"1","p的都没人形了"
"1","现在大多数中国女性是整个国家的负担"
"0","借个楼哈，原贴被删我就在这里发了。这个人把我恶心到了。"
"1","黑就黑吧，地域黑是慣例無可避免，黑呀黑就習慣了，不在乎了。"
"0","她们被外国杂种羞辱了，国男愤怒受不了罢了。国女被好好对待，没人会反对"
"1","这患者是黑砸，思维错乱不奇怪。"
"1","真把自己当回事了，你的意见有个屁用"
"0","其实闹得越大越好，别成天就这点破事，最好像韩国一样三次机会"
"1","不守男德的东西"
"1","嘿蛆离不开䓯品"
"0","PC咋啦，这些人对自己人狠"
"0","嫁鸡随鸡 嫁狗随狗？无语"
"0","整死都想，还批判，你父母得被你气死，还得和你断绝关系后，反正我是这种人"
"0","反正只要争辩起来就会 安啦上海银。。。。🙄"
"0","不如，人家是生意，要收钱的，这个是免费。"
"0","5楼把我拉黑不敢面对咯"
"0","啊这因为我国注册球员远远少于其他国家啊"
"1","这种就是典型的废物龟♂了兄弟们，大家引以为戒"
"0","你有钱的时候就会有了"
"0","这个企鹅号搜不到啊"
"0","我支持的是恋爱自由，我的话确实歧义挺大的😓"
"1","我歧视gay,我也歧视你的观点😄"
"0","啊啊啊啊好可爱好萌啊！！！"
"0","南美棉花小黑马"
"1","什么垃圾昂撒"
"1","黑龙江籍新疆人不服"
"0","他们拿钱了，要恰烂钱呀"
"1","小红书微博第二，没有老哥冲啊"
"0","能处就处不处就离下次想结婚先提出来你的要求"
"1","看到同性恋就想吐🤮"
"1","失足妇女：呸，老娘没那么脏"
"1","人家反同不对嘛？你在苟叫什么？"
"1","不按照母拳预定的轨迹和套路行事，大概率被母拳成为普信"
"1","安徽也爱黑别人"
"0","不用怀疑，就是这样"
"0","时间已经证明了一切的真相"
"1","一个破演员而已"
"0","有人知道吗？"
"1","顶，气抖冷，剁jojo，男人什么时候才能站起来，男权的兄弟们呢，顶起来啊"
"0","真的是一整个大无语事件，不知道有没有看到我这篇回答然后剥开信息茧的男生😅"
"0","嘿，我籍贯就是大石桥的"
"0","所以不说不就行了，你为什么要说呢。。。"
"0","拿刀的女人确实比强壮的空手男人战斗力高。"
"1","给大伙辟辟，也许有些人的女神背后就是这种模样"
"1","嘿玩意基因自带从小都有攻击性"
"0","白人怕是已经输了，人口比例都不行了"
"1","黑人属于是自己放弃自己，和其他人没关系。我觉得应该尊重他们的选择，送他们回非洲，让他们自己折腾去。"
"0","终于看到一个正常评论了。"
"0","对于小管家来说，是没有匿名的"
"1","白人也接受不了。😄"
"1","正黄旗的啊 慈禧是你奶奶??"
"1","舔狗以为舔狗最后应有尽有，谁知道没人领他的情。"
"1","知乎上最多的就是伞兵问题"
"0","就算你反对了那么个法案，现实总会给你一些更致命的新发现原来这个法案只是结果，不是原因"
"0","我就是不婚主义者，个人自由选择，反正人这辈子结婚生子就是在赌博，也没啥意义！"
"1","看到没，这就是龟男舔狗养出来的"
"0","缺了一个城市，西安热搜之王，流量密码"
"0","这种手术正规大医院一般不做的。地方我不太清楚"
"0","你长得帅的话这个回答就攻击不到你啦"
"1","西安本地作风彪悍的大多是东边某省逃荒过来的后裔"
"1","这些人淹不死的，应该学小日子，强制充军扛弹药箱搬炮弹"
"1","那女的应该被那个黑g的黑d透烂了，嘴也吃黑d吃烂了"
"0","小朋友，别再给河南招黑了"
"1","给黑人生孩子的国女基本上在社会上大概率会社死🤣🤣"
