"1","学习不好怕什么，可以发挥兽性优势去踢足球打篮球啊。"
"0","？你要不要问问答主那人有没骚扰他，有的话我删评，没有的话你删评"
"1","的确挺善良的，我在动物园看到过"
"1","理客中跟女拳是一回事所以一起超度掉就可以"
"0","彭家桥和梁家渡是它们最好的去处。"
"0","那么日韩港台女权谁支持的！？"
"1","我怎么听到汪汪的狗叫？"
"1","还要排出云南和广西，毕竟云南都是悍匪，广西都是鬼火少年。🐶"
"1","当然不会，但我想问的是存在这样的一个通讯录吗？"
"1","小时候啥也不懂 看到男孩子拉手就会觉得不适 现在看见自然的会联想到性 就更不适了[摊手]"
"0","雀食 但这本质应该类似于一种“过敏”"
"1","中专就出社会的公主罢了😆"
"1","孙杂能不能速度点出来给本帅哥跪下，一个个都被本帅哥一牛子捅哑巴了吗"
"1","不专拉外国人皮条的窑姐，人家都不感接黑人的客"
"0","我河北人从小到大没听过什么黑河南的言论，第一次听到井盖梗还是个新疆人说的。"
"1","可别了，正常女的也会恶心女👊的，起码我身边受过高等教育的女性都觉得女👊傻逼"
"0","求私聊天记录惹"
"0","或许这就是女权吧"
"0","这次我是真的没绷住"
"0","我就问了个问题怎么扯上时代了"
"1","潮汕人？你们的刻板印象不是钱多吗🥺"
"1","就是你好好跟他说，他觉得你怕他。你收拾他一顿，他从此对你毕恭毕敬"
"0","当你爱这个人时，怎么能给其它人同样的爱，而且爱的发生机制不更是偶然的毫无道理的吗？"
"1","楼上那个没菊花"
"1","慰安妇是被强迫的，eg是自愿的，eg真正的应该算是汉奸的老婆"
"0","如果你的亲朋好友出现了同性恋呢"
"0","要不是生活所迫谁愿意远走他乡？"
"1","犬父无虎子😆"
"0","啥？你带那。。。"
"1","我以為女拳師討厭腐女，原來這兩種屬性是能兼容的"
"0","10，不能负担家庭责任，几乎看不见；"
"1","惯的，用电炮和飞脚跟女人沟通，你会发现她们变得很讲理"
"1","的确有人天生是坏种，比如你"
"1","非我族类，其心必异"
"1","中国女人喜欢黑人，黑人太大了"
"0","广东珠三角以外地区也极其符合😆"
"0","可以采访一下各位的学历吗？"
"0","说的也对😅"
"0","道理都懂，数据不说谎😆"
"1","黑蛆经济来源分为寄声，帮派，䓯品，奖学金。"
"0","对啊，从根本上讲就是资源问题啊"
"0","可否封了这个索玛女王并立案调查？"
"1","按我的想法，它们只是类人，何来种族歧视?"
"1","傲娇永恒基佬吃阻断药造成小脑分泌大bian,S在键盘面前"
"0","内卷到最后，就越来越有六镇起义那味道了"
"1","对策：没错，我就是让你伺候我照顾家务当保姆，不然叫你吃干饭的？"
"1","搞大外国女人的肚子跑了还不够，这只是开始，以后在国内也会这样。"
"0","荷兰八智齿"
"0","地域歧视跟刻板印象分清楚好不好"
"1","他怎么这么虚伪啊？脸呢？"
"1","这个叫双亲祭的用户的幕就是个薇安妇吧"
"1","😆😆😆这话是事实。福建省内相互歧视的例子多了去了，我们早就习惯了。"
"1","爱猩动保人士"
"1","美国有种族歧视，中国有地域歧视很正常"
"0","黑人男人和白人女生？"
"1","要是我周围朋友出现个和默交往的直接拉黑不用再见了😅毕竟我怕哪天把我也拉下水"
"1","小红书绝逼是狗汉奸带的，★★在这就是工具"
"1","在女权眼里只有中产以上才算男人"
"0","还会我父母靠谱点，找的还没这样"
"0","这就是悲剧啊，怎么会是喜剧😅"
"1","没有同性恋基因的人是不可能被掰弯的，就像同性恋没办法变成异性恋一样"
"1","微博女厕所啊，哥"
"1","引进黑赚钱。"
"1","恶心！滚去非洲，别把串串留在中国"
"1","只要女的嫁走，别留在中国就不歧视"
"1","这么大怨气啊，为啥不找个黑人妹子做女朋友？"
"0","大致意思是有人开始用黑人的办法对付黑人？"
"1","她们才是普信女"
"1","抓出来鞭刑！直接鞭到死！"
"1","最好别找，媚黑的女人已经烂到根了"
"0","能不能混进去爆破"
"1","精神科医生好久不见我是反同二局的"
"1","不拉女的就是了，吊事没有"
"1","你是不是没别人的大，自卑?"
"1","过来看看西边人的素质"
"1","这些标子比男人冷血得多，百分之八十都是"
"0","这文字才是带脑子的"
"1","投资人造子宫，找相关从业人员发泄信誉"
"1","江西不配被黑"
"1","胡说八道，男性都是希望喜欢黑人的都去非洲。而不是变成烂裤子以后伪装找国人接手"
"1","她老公知道了，之后她的备注就是女表子了，极大可能离婚，然后亲戚朋友都来劝她老公大度🐶"
"0","一个人的品位由TA选的配偶的层次决定。"
"0","大多数就像答主说的不会明着正式割离，但以后就断绝往来避免见面了"
"0","圆圈＝○＝?"
"0","高级黑了哈哈哈"
"0","确实，结婚我不敢说，但是谈恋爱真的很简单……😲"
"1","笑死了，东北宇宙"
"1","我感觉长三角一些媒体搞地域黑比南方周末狠多了"
"1","那果子狸是男的吗？给这个人点赞的都是男的嘛？😄知乎b站微博里面的女拳师都是男的？"
"1","坏起来了兄弟们，原来真有荣誉女人"
"1","河南地域黑是最严重的"
"0","可能店家就是江浙沪一带的吧，自然运输费越近的越少 越远的越多呀"
"1","到什么山上唱什么歌！身为中国男人，该负的责任就得负，不能跟黑人一样！"
"1","你老公要是知道，估计要恶心你一辈子😄"
"1","那不是老实人，那是愚蠢"
"1","中国女人是被哪个古龙迷香给控制了大脑神经和思维阿。"
"0","自从把他照片曝光后老私信追着我骂"
"0","真没必要这么骗自己… 不过也是要看个人魅力的.."
"1","远离男人，拒绝婚姻，从你我做起"
"1","喜欢黑人请去你男人国家，赖在中国就不要怪别人骂了，动手都是应该的"
"0",",我把楼上删了，这种就是故意捣乱的，没必要和它多费口舌"
"0","同性恋是不是病？同性恋者感染艾滋会不会传染给人？再看看我国医生回答。"
"1","图沙黑蛆是人类未来大势所趋"
"0","表情传神，哈哈"
"1","为什么图里的有智慧的人全是男性？"
"0","别看了回老家还是10W彩礼的哦"
"0","哥，你这是典型滑坡谬误😂"
"1","我们都是直的，不弯，你以为谁都像你一样没有啊"
"1","B站绝对下一个微博。女的势力绝对有8成左右"
"0","听她的可就真毁了。"
"0","女的看得上药娘？她又不是女同……"
"1","而且你说的“细胞都在反感同性恋”用稍微科学一点的话来说是“在无意识情况下就看似无理由的反感同性恋”"
"0","匿名随你怎么说"
"0","你也是反同的？"
"1","SB，吃馒头咸菜都觉得浪费"
"1","到時我們像法國一樣被黑化就你就知錯了，我們就是擔心這個。你還別說，我們思想還真有些血統論"
"1","刚要骂，一看原来是进女权吧了，最近女权吧反噬有点严重啊，什么时候再图图啊"
"1","收钱说话的走狗罢了"
"0","最近缺钱，请问下怎么样发帖才能有钱？联系谁领？贴吧等级我可以刷，有空告知一下，急。"
"0","哈哈哈就原谅伟大的造物主吧"
"1","没啥可说的，典就完事了，呜呜呜，原来我们男性出轨不是个例，我给男性丢人了呜呜呜"
"0","当然，为啥你觉得哥不直啊😊"
"0","楼主可否拉我一下，一直进不去"
"0","真的是哈哈哈"
"1","我嫌弃他们丑😅"
"0","应该多科普"
"1","地域黑就是明明视频里的人的口音就不是河南的，新闻标题非要扣到河南头上😭见过太多次了"
"1","留在这坑别人么，跟过黑人的女的十个有九个都有艾滋，"
"0","你这样找什么女朋友"
"1","确实男人结婚离婚都是扒一层皮女人结婚离婚都有钱赚能过得不好吗？拿着男人的钱可不舒服吗"
"0","贬低自己国家有什么意思？"
"0","😅这人男的，你看他往期回答，笑死个人。尤其是88年女相亲那个。"
"0","动物都有同性恋，人类能没有？😅多读书，别读死书"
"1","混血，眼睛是蓝色，混了白皮猪的血"
"0","我不好评价"
"0","快进到江西起义"
"0","男的叫邓金军。女的叫谭海秋，假名陈琳。一个茂名高州北坑的。一个柳州鹿寨的常出没于东莞长安领帝酒吧"
"0","是啊，我能理解你的感受。但请你保持对那些好的同性恋的基本尊重好吗？"
"1","第一条已经把位置局限到北方省份了😅南方智慧人怎么会被黑呢，对吧。"
"0","zhu，shi"
"1","我们这些原住民终于可以爬了"
"1","支持天降正义爆杀理客中"
"1","同样女权所说的家暴男也很少😆，为什么要把部分的家暴男上升到整体？😆😆"
"0","哪里小偷比武汉少 (具体地名)"
"0","按照你的逻辑你可以和男人doi的，只是你不想罢了"
"0","我也想知道现在如何了"
"1","老子就是种族主义者"
"0","我想当个黑人，来中国留学……"
"0","鲜卑人还有记录吗？早同化了OK？"
"0","老爷您可饶了我??"
"1","同感，我等不及看国钕乐子了。😆"
"0","来卖凉面那~"
"0","什么越南新闻"
"0","湖北话好听，但是武汉话难听😅"
"1","真没必要这样说它她们，等下你违背妇女意愿了"
"0","请不要看到黄皮肤的人就认为是中国人，早期很多“组织”用其他国家的黄种人和外国人的合照来骗国人"
"0","电脑不能投票？"
"0","算跳车难题。"
"0","知乎同标题、同名，欢迎关注"
"0","从空降吧主到改贴吧目录，现在连吧名都能改了，度娘越来越会玩了。"
"0","这个赞太少了点吧。"
"1","是的，没有哪个省的人是应该被黑的"
"1","穷不过三代，俺们这些底层断子绝孙的考虑几百年后事情干什么🐶"
"1","丑肥成这样还要拍视频来恶心人真是好笑"
"0","搁谁头上都得抑郁😕"
"0","慈禧说得真对"
"1","大郎，该吃药了"
"1","以为黄白混就好？愿意混的都是比较差的，长相好的极个别"
"1","不，应该说为什么不做子宫摘除手术，这样不是更绝。"
"1","伞兵，我是友军，没看我是高级黑吗"
"1","如果一个女的错了不懂认错，她就没以后了。对就是对，错就是错。"
"1","上个星期我靠着举报三非黑人赚了一万多，还是兼职做的"
"1","得个艾滋病，人生绝对废掉了"
"0","double kill是吧"
"1","基佬恶心人所共知，基蛆所做人神共愤"
"0","nb阿楼主可以开经验分享吗"
"1","应该不支持，去骗婚，把直男的老婆抢掉，反手再下药XQ直男"
"0","这是故意杀人。"
"1","我还在杭州等你呢，妖怪你在哪里？"
"0","奥运会都和最好的比，怎么其他的和最好的比就是屁股歪了？😲"
"0","说得好，祖国就需要你这样的栋梁之才🤭🤭👍👍"
"0","这四条对应的国家法国瑞典"
"1","雇个穷的，得癌症的，去泼她一脸流酸，让她生无所恋"
"1","全国黑上海，上海黑白完，所以被黑的最惨的还是白完。"
"0","你这个数据是2018年的，老掉牙了"
"1","在姬圈有个别人还觉得“和男的睡过的女的都很脏”也挺无语的"
"1","本来就是宿舍的规定，楠拳自己不遵守，这下北师大已经把2、3楼层设置不可按，2、3楼都没得坐了。"
"1","我见过一个这样的，表面上除了工作不会和她说第二句话，内心中是深深的鄙视。"
"1","nt言論以博得流量"
"0","这是高铁或者动车车座"
"0","纪录片什么名字啊"
"1","经受过国女的图男言论还能对国女共情或多或少沾点?"
"1","动点脑子行不行，你的三观真的有毒"
"1","你没有必要强调自己的性取向，因为没人会喜欢你这头正宗肥猪"
"0","女权：我成替身了？"
"1","自古……小人难养也"
"1","你是个什么逻辑，臆想别人喜欢你?"
"1","河南人，但经常被黑偷东西。新疆人被黑偷东西的也很多。所以答主被成为河南籍新疆人！"
"0","我支持不买"
"1","因为非我族类其心必异是汉族历史以来总结出来的经验😜"
"0","天啊不加精置顶"
"0","你把广东放在什么地方了"
"0","已经失了道了"
"1","飞周只会万简单的乐器，稍微复杂一点的玩不来。人家要花很久时间才能学会，飞周人没有勤奋的心，水平很低"
"1","哎呀，该不会是我的拳打到你了吧？给你揉揉"
"0","控评呢，痘印没人冲"
"1","不是对黑人歧视，真的是一想到这个女人跟黑人水果，感觉好恶心，长得漂亮又怎么样，还是很恶心"
"0","别灰心，种群铁律亘古不变，神州不止一个黄巢冉闵"
"1","反过来也是一样，一个丑的直男也完全没必要担心会被同性恋看上😅😅😅"
"0","她和红警蓝天是什么关系？"
"1","如此完美？哈哈哈，就胸前那干瘪的半两肉嘛"
"1","彩礼吧老早被女拳傻卵们占领了。"
"0","酒桌谈这个不恶心吗"
"1","河南人在我们北方名声真的很差，其实还是有原因的"
"1","第一印象，河南：穷，人多；东北三省：出生率全球倒数第一；新疆：治安可能不是很好"
"0","得到了不感恩失去了就怨恨。一天一鸡蛋一天不给就欠一鸡蛋。"
"0","相由心生，这个眼神真的很阴毒"
"1","无母爱直佬只会骂人吗，除了骂人你还会什么，会被骂，对吧"
"0","恶心死了！"
"0","唉我这个甘肃兰州人也不说啥了"
"0","现在很多人分不清女权和女拳的"
"1","说真的我在部队黑河南人最多的是河北人🤣"
"1","活该，谁叫你们接盘的"
"1","反自己人可还行我德二人就静静的看着你们内斗初二不好好学习当双标儿，你连群里搞反同主义的都不如好吧"
"1","地方电视台，听不懂换台呗，上海人在上海跟上海人讲上海话，关你个外地人什么事?入乡随俗不知道啊?"
"1","女性基本上连寒暄都不多了，网上个个捍卫女性的恋爱自由——这是不是证明了女权的虚伪？"
"1","活着浪费空气死了浪费土地的渣子们"
"0","抖音群演且可兼职其他"
"1","好吧，你说是就是吧，不过你的一切将被伪娘掠夺"
"1","然后畒被男人压在夸下摩擦了几千年，现在有的一点权力还是男人施舍的？看来还不够完美"
"1","师尼长技以制尼"
"1","没有就对了，你们本来就是百越汉化。"
"0","其实不然的，明显反对的还是更多"
"0","是的，包括上海的民间大V博主"
"0","图来了😆😆😆知乎竟然不让上传超过5M的GIF😅拍了好几次😅查看动图"
"1","小女站，舔狗站"
"0","0号病人是同性恋把？同性可比异性更容易传播"
"1","蝈籹内卷也有一手"
"1","这个基佬又来教养人传艾了"
"0","你拿手机干吗。直接问呗"
"0","赞，支持你的观点。"
"1","挺你，默只要不来中国，就是好默"
"0","也可以说，大多数中国人祖先都是古河南人。"
"1","爱太廉价，每个人都有，所以我对你的话没意见。"
"0","如果这个前提不足的命题为真，那被晒黑基因岂不是就改变了吗？"
"0","论据呢？我🇺🇸待过三年，亚裔男性在奥斯丁婚恋市场可是抢手得很"
"1","喷神，你这是在歧视女性，号不想要了🙂"
"1","陆续有无辜路人被烧晕，情况十分紧危机，人们正迫切地需要着反同战士的登场。"
"1","龟男！还想拉女的"
"0","🥺这样的直男好少见额，羡慕了"
"1","如果能坚持是处女也不要给钱而是AA、互助的话，中国人便能进一大步了。"
"0","如何评价哪个评论北方人赖在南方的南方人想赖去日本🤔"
"0","东南亚小国人种可能和南方人差异就不大"
"1","吧主，强烈建议去找有力的同盟，誓死守住反同恋吧"
"1","得了吧，他们如果分的清两广江浙沪也不至于对着江浙沪开喷南方系了。"
"1","黑人绝不是什么弱势群体"
"0","有几个男的天天颜文字啊?"
"1","和黑人那也配叫爱情？😆"
"0","好好好你最棒。"
"1","这不是典型的普信男么，真下头"
"0","老哥你说了好多人担心的事情"
"0","日韩女权已经用事实证明过了的东西，还需要相信他们的理论？"
"0","只因怕打针，爸爸狠摔亲生孩子，男子气概？父爱？"
"1","变她ma了个🐔8，拒绝舔狗从我做起"
"0","黑人到底是发明了足球或者蹴鞠这项运动呢？还是参与了最初游戏规则的指定呢？都没有吧。"
"0","反正我不结婚了，这辈子就这样吧"
"1","你们上海人黑白完人的时候也没见你们心疼白完人啊。搁这装什么小白兔😂"
"1","楼主魔怔人，刚从医院放出来大家别见怪"
"0","笑 die"
"0","你错了，男权还是女权，都是偏激的，没有任何一方宣扬的是平等"
"0","面对公开的外人评论。可谓是最公开公正了。"
"0","真是够孤单的，我觉得你应该融入人群，修复自己的抗逆力"
"0","20W你天天去洗脚能下半身都洗秃噜皮………"
"0","我是回民，我听不得这些"
"1","哎就算没有亚裔他们也还是社会的底层"
"0","我寻思这不都是上海人自己争取来的吗？😆"
"0","好好，钱给你，你来买"
"0","我在浙江。我觉得气候而言。并不宜居。"
"0","如果国家在这方面立法就真的好了。"
"0","笑的肚子疼"
"0","别这么感性，男人都这么没逻辑性吗？这个真辟谣了。"
"1","这不慕勾阿娜么"
"0","这波是否是虚空立靶了？"
"0","那中国就会失去林虎将军和王德民院士"
"0","想要去河南，人工出货量最大的地方，那些品牌商都偷偷摸摸跟河南人造厂合作。"
"1","感觉不至于吧同的就一群乌合之众没必要浪费时间精力"
"0","河南省有一个白头村，原因是地下水含镍丰富。"
"1","没地方拉屎的人会不会拉我家门口?"
"0","处女崇拜是很大的群体了,可不能随便忽略不计."
"1","可以上女方的就咬死一夜情"
"1","你们双方互相泼脏水的精彩程度堪称世纪大戏"
"0","再说了，个人是个人，群体是群体，我还被直癌晚期在那磕呢"
"1","看了几个小品，天天喊着结婚生娃，能不能关注一下别的，默不要出现在春晚行不"
"0","非洲不是天堂，但是消费水平低，就算收入更少花销也更少"
"0","可能是本人表达能力的水平十分有限，竟然让您产生这种曲解，真的不好意思😂"
"0","强求别人接受自己的观点、和自己不一样的观点肯定不存在，这个和同性恋其实没什么关系。这叫狭隘。"
"1","搞半天，她也是个普通人。结果自己不把自己当人"
"0","东北人彻底麻木"
"0","可怜的孩子，抱抱你"
"1","咱就是南蛮后代"
"0","哎，心疼你"
"0","所以它怎么你了？"
"1","这次唐山烧烤，就有人说“听口音是东北人干的”，任何坏事，都扣到东北人头上"
"0","成这个样子 谁之过？"
"1","我觉得你根本就没有仔细看我说什么。我强调了，不接受同性恋很正常。"
"1","自杀男性也要负责了，还是结婚率生育率太高了?"
"1","批判的武器不能代替武器的批判对于女性，我们就要搞武装斗争因为网络骂战除了爽以外根本不解决任何问题"
"0","是否真实？"
"0","絕對的力量面前任何技巧都是扯淡"
"1","分裂粪汁😄"
"0","我身边是没有这种媚外的女生😅更别提媚黑了🤣"
"1","劣等不用杀 社会不能用阶层淘汰？倒装还是往后稍稍吧 能给让吃上饭就算人 这就已经是人权保障了"
"1","上海人是超级排外，不是黑，越老越排外。"
"0","似乎我湖南除了媒体以外其他全部符合🤔这个有点放之四海而皆准的感觉⁉"
"1","跟着一起回非洲就行，留在国内就算了。"
"1","我看看还有没有🐶出来维护他"
"1","你说的对，我们不是虚伪的白左，不喜欢黑人就是不喜欢黑人"
"1","凭什么女的能扭男的就不行"
"1","这种就是为牢房准备的犯人，从小就能看出他很有暴力倾向智商低喜欢攻击攻击人"
"0","***倒是开个权限让我评论啊"
"1","这些南满估计连河南人都没见过就开始变着法的黑河南、黑北方了"
"1","那南方人都烦东北人也是有原因的吗？"
"0","那我说异性恋不好，被骂，是不是别人太偏激了？"
"0","年底上大分"
"0","你当然可以讨厌，这是你的自由。我就是河南的。我从来不偷，不抢不骗。行得端，做得正。"
"1","同狗日常迫害正常人"
"0","韦小宝真可爱，他是中华各族人民的结晶。"
"1","还在挖，能整点阳间活吗"
"1","原来是他不被娘服待见"
"1","黑人本来犯罪率就较高"
"1","吧务和几个等级高的蛇鼠一窝，整天高强度巡逻删评，双标玩的飞起"
"1","生而为男，天生有罪"
"1","不会停下脚步，直到业火将华夏血脉的黑色荡尽"
"0","上面的骚操作不是一波两波。"
"1","果然是人才，红毛鬼子婊子都不接"
"1","原来这个吧有反虫吧主不过最后就是被跪虫族就整掉然后过家和百毒从此就监管此吧把这个吧弄成无主之地"
"0","不对也对。对是因为确实存在这个问题。不对是因为歧视主要针对的是年轻人，对老年人观感目前还行。"
"0","你爷爷分家，你爸留在本地开公司，你叔去外地开门店，到了你这辈你说你是你堂弟的爷爷？"
"0","哈人，太哈人了"
"1","回不来最好，跟过黑人了，谁还能要，回来还得欺骗老实人"
"0","女权组织都批判。。。什么成分？"
"0","是的是的，没错没错，我乡下来的，没读过书不知道"
"1","男的也不分享，分享这玩意的不是纯初生"
"1","刚刚看到有个1很喜欢你你还单身吗"
"0","_xDE05__xD83D_这不直接扣押金？"
"0","冲就完事了"
"1","接盘侠太好了，帮我们排雷烂裤裆"
"0","男人嘛，就该要大度一点"
"1","主要是被嘿嘿玩过的，那不是一般的思想，那得多么的。。。"
"1","凭那句你您不好看，女拳就已经炸了，直接拿出包里的刀开始暴金币了"
"1","就应该用膝盖压在黑蛆的脖子上制制他们，黑蛆就怕这招"
"0","是的 内斗"
"0","还是跟个体基因有关"
"0","之后那女的就一直在后面骂我，就刚才的事，应该没啥后续了，有后续我在吱两声。"
"1","中国引进那么多，迟早都会出现这样的情况"
"0","😅我就知道会扯上安徽"
"1","哈哈哈哈哈怎么一天到晚把彩礼挂嘴上 谁问你要彩礼了"
"1","觉得有人故意，然而这小傻瓜还不自知，一个个沉浸在愤怒的高潮中无法自拔😅"
"0","求靠谱关系😜"
"1","我怕有一天我们的刘备曹操孙悟空等等这些也是黑人出演"
"1","你好棒棒呀 知道的真多你家那片还有井盖吗"
"0","可以要求学校再装电梯，可以要求学校分开男女宿舍，不让人坐电梯是个什么鬼⁉⁉"
"1","你是自卑没有自信还是有艾不能见人吗？看看某基佬也不会蒙面穿衣服发照了"
"0","悄悄，这位师爷就是装糊涂的高手！😄"
"1","我一说是安徽人就说我小偷小摸"
"1","。基本上故意发布这种信息的不是?就是真nt，也许是男的奥"
"1","美国是移民国家，黑人也是他们国家的一部分，但是黑人不是中国的一部分。"
"0","才中国大城市都有日本街，文化入侵相当严重"
"0","不承认他是中国人！"
"1","这样的人一辈子都不会被人看上吧"
"1","我们同性恋太正确了"
"0","男权是男女平权。请不要污名化男权。"
"1","我怕性病艾滋病🤔"
"1","你想多了，要不是你们知乎一些吃饱了撑的到处举报三非黑人，被遣返回国，人家日子过得爽着呢"
"0","可也不是全部河南人呀，不能以偏概全，每个地方都会有坏人的😢"
"0","发错地方了吧"
"1","我一直觉得，绿帽宝要是能做出来，市值肯定超过阿里"
"1","我只知道小时候天真的以为外国人都是很善良巴拉巴拉的，现在呵呵"
"0","破坏中非友谊，把你抓起来"
"1","拳塔一体才是最大难题"
"0","时隔一个月过来看戏"
"0","那不算啥，还有更恶毒的，都是些怀着不可告人目地的阴险小人而已"
"0","说不好啊。。。。"
"0","共产党的功劳"
"1","男的说要孝顺父母叫妈宝男，女的结婚时说“我妈要几十万彩礼，我是乖乖女，我听我妈的”"
"1","冷暴力算不算家暴？限制消费算不算家暴？如果都算，那其实女的家暴男的更多。"
"1","春日祭幕刃嗎玩就拉黑，也不知道她幕就是个揉遍器祭♀"
"0","欢迎关注撑同吧"
"1","知道nv拳最大的敌人是谁吗？是亲子鉴定，是基因技术，建议打拳的认准敌人。"
"1","地域黑怎么也避免不了，我一个从小从苏南去东北生活的人说是哪儿的都不合适🥺，黑去呗。"
