"0","我真的非常害怕浙江人 点开主页清一色滤镜和戴妃包迪士尼纯欲妆岁月安好 一开口吓死人了"
"1","舔狗也本来不是结婚去的，骗炮的，骗钱的，女拳自己都知道不靠谱"
"1","歧视又怎么样，我们压根不欠他们黑人什么。"
"0","要和黑人哥们搞好关系"
"1","地域黑和分裂国家的汉奸没有区别"
"0","我去国外下了？城门失火殃及池鱼。现在我住的地方都开始流脓了。🥺"
"1","普信女真下头"
"0","有梦想是好事"
"0","找客服人工举报了"
"1","胡说，黑人各个都是王子，等着继承亿万家产，嫁去非洲就可以享受美好生活了"
"0","我们是文明人"
"0","mimei链接"
"0","当代袁天罡啊，神人在民间"
"0","女友是越南人啊，哈哈哈哈哈哈，怎么不找个白人小姐姐呢？"
"0","所以做过检查了没，现在婚检可都是保护艾滋病患者，不得病人同意，绝对不泄露给外人，包括病人的未来家属"
"0","非洲吧，分享过来的。"
"0","啧，正黄旗啊？"
"0","我对国外的了解不是靠电视， 更不是靠媒体。 都是亲身经历。 谢谢✌️"
"1","你说的强迫认可，是有哪个同性恋逼着你搞基了？恐同们可是经常逼着同性恋结婚呢"
"1","黑人吧早被我们反黑站了，你还洗"
"0","这个吧有专门的QQ群吗？"
"0","嘿嘿，一起减一起减。话说潮汕火锅什么味道啊，求科普≥﹏≤"
"1","安徽没啥存在感吧"
"0","所以这是她们努力的回报，你呢，每天发几个无聊的帖子就想获得成就🐴？"
"1","洗头佬罪不至此"
"0","无所谓干嘛要匿名。。。。"
"1","被答主这样的国女喷下线了，"
"0","很有先见之明"
"1","以及一切为他洗白的狗腿子"
"0","这个大概是学校里几个同学一起约出来玩"
"1","？？？有人造子宫我家众筹一个孩子就行了，要这种幕刃给我添堵吗？？"
"0","同化，为什么要同化？"
"1","有一个香喷喷的批"
"1","那你这些闺蜜室友要是有个黑人老公，50%艾滋病概率，你还敢继续相处吗？"
"1","Y吧呗，那里每天反同的人挺多的"
"1","不奇怪，只有这种人设才配得上国铝，国铝都觉得自己配得上这种人，不上当才怪了"
"0","从哪看出的黑人更大，少看点av."
"1","一白遮百丑！美听说过美黑的。美白，美白！美听说黑人选美的。与黑人结合就值得批判！"
"1","知乎早就失守了，仲裁官几乎被女拳占领了"
"0","看他的名字叫莎迪德·阿卜杜梅，应该信奉回教"
"1","还是那句话，如果喜欢大的，哪怕找头驴呢🤣"
"1","江西彩礼真的是高的吓人"
"0","论地域黑山东没资格上榜"
"0","不应该爱好白人帅哥嘛？"
"0","人家写明白了是系统删帖哎"
"1","他家里人也不是好人知道儿子有艾就要他骗婚。道德败坏"
"1","这人知名女拳，散了吧，不用理"
"0","被大姐举报没了正义的百度"
"1","让我想到了清道夫。就是传说中吃屎的那个"
"0","大鼻子，脸型不正，她妈妈说的对，发型加双眼皮会好看很多"
"1","说唱就是个寄吧"
"0","一个一年补贴二十万，羡慕啊😅"
"1","黑妞再漂亮也不敢上，万一有艾滋病怎么办？有个黑人男朋友的女生要知道艾滋病潜伏期很长的哟。"
"1","你怎么骂基佬我也不生气我也不是男的我还有男朋友"
"1","😅自从巩汉林在春晚上开地图炮，就打开了潘多拉魔盒。开第一炮是他，结果受害最严重是他自己老家。"
"1","没死刑？管不了他们"
"0","谢谢，我知道了"
"1","三万人民币都够黑人在那盖个豪宅，娶好几个老婆的了"
"1","不接收就对了。ZG不接受阿难民是正确选择，一帮神棍"
"0","都来看看别的贴的人怎么说你们主子的"
"1","习惯就好小仙女都这样抬高自己贬低他人"
"1","人家发个表白墙碍着打拳什么事了？现在大学里男生果然变态很多呀，还偷拍别人，建议报警"
"0","咳咳，那么我问你，你，是啥？"
"1","女权不是指女性权益吗？怎么还蹬鼻子上脸了？"
"0","你觉醒了，恭喜你"
"0","还是得看沈腾"
"0","感谢上天，让我们都有玉冰烧喝。"
"1","您自己不就是在践行地域黑的真谛吗"
"0","结婚和离婚都走法律程序，婚前财产鉴定保全，法律没有规定结婚要彩礼，结婚就一条双方自愿"
"0","那外国种非法务工，举报一个够你一个月的生活费费了"
"0","在广州坐了四年地铁，单次最多就看到过两三个"
"0","中国GDP超过日本了，也没见中国日子比日本混的好"
"0","不如直接放福利院🤔"
"0","我感觉你这么一说更黑了。。。"
"1","黑龙江，男的不帅还太热衷艺考。"
"1","你几把谁啊，代表全国？"
"1","以后妓院也要分985，211，一本或二本"
"1","猩球崛起，黑猩猩会成为世界的统治者"
"0","搞不懂，这是女性向的饮料吗？"
"1","哈哈哈，没想到现在妹子都挺聪明，也知道嘿人那些手段了"
"0","你这什么思想，无论什么关系，地域歧视都是被注定遭人唾弃。"
"1","让黑女生混血黑妹嫁给中国人，两代就稀释干净了"
"1","我这么说吧，哪里都被黑过😓就没有他们不黑的时候"
"1","被基佬举报了"
"0","真是正义之锤"
"0","。。。。。。没有孩子不是家庭 那叫二人世界"
"0","对对，越是大城市，越是开放的地方，就越是多。相反那些比较落后的地区到还不多"
"0","你是不是对高级妓院有什么误解；"
"0","如果不是，他怎么不拿出证据？"
"0","当然我认为恶意传播性病和艾滋的毕竟是少数，绝大多数有人性的txl恐怕也不想染上这些病。"
"0","加油！！坚持！！这个吧不能再沦陷了！"
"1","哈哈哈，上海被黑了开始反对地狱嗨了是吧？可是之前那些地方基本都被上海壬嗨过啊😅"
"0","所以那张hiv吧的截图到底是不是真的，你从来都没有正面回应过"
"1","肯定自己有原因，但是他们已经上升到整个东北人都是垃圾，低劣的种族，应该灭绝的地步"
"1","是的，我还搜过好多黑黄大战的自拍，基本都是不带套那种，那些女人真是勇敢，生怕得不上病😆"
"0","这东西不分男女"
"0","你把西安放哪了😅"
"0","我也有过好几个帖子没了，应该是他没跑了。"
"0","最离谱的不该是中国网资讯吗？"
"1","所以你们gay存在的意义为削减人口做贡献？"
"1","HIV群体十之八九都是基佬。"
"0","鉴定完毕:真大佬"
"0","这种好队友你们收吗"
"0","太羡慕了🐶"
"0","😄厉害，我也不看"
"0","为什么我碰到的河南人都挺好的，就是不怎么会开玩笑，人比较古板，没啥意思😅"
"0","没有广西吗？"
"0","毫无反馈，自然不可能有所影响，我怀疑某些人其实是对面卧底。"
"0","可拉倒吧来我们东北做生意的浙江人很多尤其温州人，我们东北人歧视浙江人 ，浙江人能有那么多吗"
"1","一口一个不生，怎么不上环啊。"
"1","腐癌说的，腐癌是你们异性恋女生😓"
"0","你怕不是对号入座？🤭🤭"
"0","有些地方挺集中的，特别是大城市和大学生特多的城市，找地方不用太担心"
"1","成天带妹的舔狗能不能死啊"
"1","额，炼铜txl能不能④"
"0","女性到底应不应该有权利呢？"
"1","成都自杀女教师吴诗蒙确实是被老黑睡服了！不是崇洋媚外！不是崇洋媚外！"
"0","戳到她们痛处了呗"
"0","那就由她去🐶"
"1","我在想田园不是不结婚吗。。那么生孩子管她什么事。"
"1","因为畸形的人只有配上畸形的爱才会觉得正常，并称之为真爱。"
"1","我女的想法和你一样我也厌女"
"0","沈大的关系有点不好说，剪不断理还乱"
"0","😓😓😓看见了，我早就举报了，这玩意就是最恶心的"
"1","幕刃和理客中一样恶心"
"1","钓鱼的韩国女拳已经没有发言权了！魔法打败魔法"
"1","楼主啊！我记得这是某位普信女写的关于男性的条件吧，改的好，还有，您的帖子里面有条目🐶，赶紧置顶羞辱"
"1","喷吧普遍男性反串带节奏，故意说一些反动的话让更多不知情的男生变成所谓男拳来无差别攻击全体女性"
"1","no zuo no die"
"0","啊哈，没了解过什么原视频什么出处，图好笑就够了"
"1","鼠婆slay惹"
"0","厉害了我的国"
"1","你去广州看看，广坎达可不是空喊的"
"1","每个eg背后也有3个黑人呢，集合"
"0","古龙水就含有麝香，合欢香"
"0","不会说话就照照镜子看看你自己，把自己的过错一切推给国家是懦弱与无能。"
"0","黑人发明零元购，无罪"
"1","这b的确不是好人"
"0","看不得人家女孩子幸福咯，女孩子就看耽美管他什么事了呢？"
"1","我批评坐地上看戏的，她就阴阳怪气了"
"0","60多岁了还不忘收彩礼"
"0","广东确实比江浙沪包容多了"
"0","猩猩拍皮球"
"1","提啥？我已经不考虑母的"
"1","这酒十分地珍贵，应该让小仙女先喝。"
"0","唉，不得不说彼此都任重道远啊"
"0","因为台湾富裕，想嫁到台湾吧"
"0","感觉清一色白的那个图和这样的食材放在一起脏了高端食材"
"0","骂她啊，别怂"
"0","我室友就是河南的😂天天听他说，洛阳口音"
"1","河南人可以删除"
"1","现在全国基本都是达成共识的反黑情绪😆你说啥时候人民这么统一，难道不是因为被折腾久了"
"0","好像从几年前，田园女权开始崛起，然后慢慢的，怎么就突然男女对立了。。。以前是真没这个氛围啊。。"
"0","现在只有韩国比较正常还有俄罗斯"
"0","嗯嗯是的，东北老弟"
"0","谁理解谁？"
"1","都是一些歪瓜裂枣的LKD"
"0","确实，万中无一。"
"1","哦？腐癌说的不是txl？😆"
"1","本贴已上首页，奉劝看到此贴的基佬都去看心理医生纠正取向，做个正常人。"
"0","前面还很同情你 看到高考加分我绷不住了😄"
"1","龟仙人只会舔"
"0","如果有人不是单身进吧会怎么样"
"1","枪毙他，他是中华民族的罪人！！！"
"1","当然 只有最没素质和low的人才会种族歧视 把自己的失败转移到别的因素"
"1","错，河南人多，反而犯罪率不是最高。数据可查，某些只有河南人口一半的省份，犯罪率高于河南😄"
"1","因为某些上海人排外带来的，这不叫歧视了叫反歧视😄"
"0","安徽南边彩礼还行吧，我家都没要"
"1","郭楠不配，还是乌干达适合你~"
"0","我只看到了“买烟都不够”"
"0","图中那个索玛女王被扒出来是个男的😆"
"0","现在有汉奸专门带女孩风向，是个团队，目的就是让中国民族矛盾激化"
"1","排外也是排你这种人吧？"
"0","普通朋友是没问题，如果是男女朋友，那确实是没用，你妈没说错"
"0","骗一个人，是说明了在意他。"
"0","自己看吧反正我有被笑飞到"
"1","哈哈哈杨笠就是个丑女拳"
"1","一看都没进化好"
"0","我被封过一星期。说的很光荣似的"
"1","看到评论。emmmmm。我其实连评论的勇气都没有，好卑微一上海人啊。"
"0","原因很简单，请问女的是被黑人强奸的逼的吗？大部分并不是吧，似乎是她们自己的意愿吧"
"0","太可笑了，苏北跟江西八竿子打不着的怎么会干起来🤣"
"0","佛波乐？这是啥？"
"0","吧友们不想吃牢饭，劝你耗子尾汁"
"1","我没这么认为。不过黑人想尽一切办法来中国蹭我们的福利，赖着不走倒是真的。"
"1","这个女网民她是高级黑，是黄皮肤中国人嫁给非洲黑人，她是研究生学历！"
"1","小女孩都吓哭了，放着畜牲来干嘛呢？回非洲好好待着去"
"0","那你没看见的大部分不喜欢黑人的女人多着是，幼稚"
"0","办法不是没有，学日本，韩国男人即可。"
"0","同性恋先天的？？"
"1","NBA的脑残粉男的和EG一样，low到骨子里"
"0","恶心是你的自由没有任何问题，但是能够隐忍不外泄学会尊重别人，能够换位思考则是修养"
"1","南京人民表示，用历史来嘲讽南京人民的不在少数，最近这事也一样。而且说的都是胡扯的。"
"1","是东北先挑事的"
"0","默，沙东，这昵称有点东西"
"0","我觉得还不如让她们去搞，这样我们才能团结更多受害者，那像这样，还是星星之火"
"0","放心吧，没有男的会喜欢你"
"1","所以没错为什么改？直接普信男小仙女打起来啊"
"0","答主用这段绝了！"
"0","在台湾人眼里，中国好像就他们一个岛。"
"0","用快手么？"
"0","真的吗？我看有个评论说，别人压根没提中国女性，举的是韩裔女性的例子呢"
"1","我原来一直奇怪为什么大学淘汰男讲师那么多，女讲师基本没有。原来如此，原来如此"
"1","笑死了我发了一篇贵物男拳帖被删了"
"1","最后说一次，别在我评论区理发店"
"0","本来想笑的，突然笑不出来了"
"0","别尬黑，猪头肉可是上好的下酒菜。"
"1","比异性恋更加处心积虑地想要孩子，但要想方设法地抹杀异性的地位和作用。"
"1","同是病，需要治疗"
"1","基佬都很变态"
"0","贴吧就这样，随缘吞帖，所以贴吧越来越凉了"
"0","说的好，建议直接打砸抢"
"0","虽然有点绕、但还真有道理"
"1","先浸猪笼再用火刑吧"
"1","吧里不婚不育的女权出来吱一声？"
"1","古代的昆仑奴，现在的昆仑👴🏻"
"1","听说艾滋病可以潜伏好几年，评论区的可以撤退了🤣🤣🤣不害怕吗"
"0","我认为男权不是封建父权。"
"1","我不喜欢我还得去支持？现在地上有坨屎有的人喜欢吃屎你不喜欢吃你就冷漠？"
"1","我真的怀疑SB发言的逆天程度啊"
"1","现在不能发尼字了"
"0","我姐姐夫有空就带娃，或者就往图书馆里钻，很少出去，"
"1","这个时候身为阉人的你反而不如不阉的时候呢"
"1","可能因为是鸡汤吧，向着男性说话的，或许会叫鸭汤。能毒死鸡的汤当然就是毒鸡汤咯。"
"1","猩猩之间的交配有什么稀奇的"
"0","额，还是不要结婚组成家庭了，会很不幸的"
"1","和那群基佬一样，安能辩它是雄雌"
"0","我之前的贴咋被删了"
"0","还没热度应该不会"
"0","忽然之间天昏地暗世界可以忽然什么都没有––《忽然之间》莫文蔚"
"0","这个人说才只有四分之一我回他啊"
"0","为什么不打胎"
"0","有帖子链接吗？"
"1","不想一棍子打死车、房、彩礼你们倒是一视同仁啊😆"
"1","你不说了嘛，男人是“娶”，女人是“搞”"
"0","你让你爸妈先收敛一点，也没你了"
"1","一有精神小伙要么扣东北的帽子，要么扣广西的帽子"
"1","毕竟在外地你做的好了他们会说“你一点不像上海人”"
"1","占了便宜还卖乖🤮"
"0","最后一段暴露了什么，大家细品"
"0","我这么纯洁可爱。。。。。"
"0","当你扔出去一块砖头，狗叫了就说明砸到狗了😆所以如果问心无愧就不要对号入座"
"1","这种喜欢自称本宫的多半是有性别焦虑问题的通讯录"
"0","你说的这些，跟你所在地的人大代表说去，跟女生说不着"
"1","黑蛆靠下体不知道能不能征服世界"
"1","我劝你赶紧删了，显得你懂得多？回来艾滋病，直接隐瞒找老实人，难道你想接盘？🍉"
"0","给你一个送我彩礼的机会"
"0","被吞了两次终于发出来了(⊙o⊙)！"
"1","黑的暴行实在太多了，看到这些黑的所作所为还有人要为黑打抱不平吗？要是还有的话你的良心不会痛吗"
"0","啊对对对至少人家有人了你连个人都没有😨😱"
"1","凭啥把锅甩给北京？"
"1","你们江北不也说安徽，江西。只准你们讲别人，别人说你们就成地域黑"
"0","不是所有蒙古人都骑马上学，但是所有天津人都会说相声。"
"1","来自接盘侠吧的神贴，大家咋看？"
"1","看抖音的人脑子里都是什么成分不用说了吧🤣🤣"
"1","对女性共情就是一种错误，真正的平等是不能够共情的"
"0","河南老乡前来报道"
"1","应当这样夸它:人家超时空爱情,你是跨物种恋爱.😄"
"0","我就是河南的"
"1","我一直奇怪为什么和黑人没有生殖隔离？谁能解释一下给我听吗？"
"1","河南是中原，华夏之源，我觉得挺好一地方，郑州洪水里人也很热情善良，为什么被黑啊😅"
"1","这只是个例，那你是没见过江浙沪一带地域黑别人的。"
"1","有好看的，是哑光的巧克力色，纯黑的就算了吧"
"0","那娶了外国人呢？买越南新娘的呢？"
"1","对牲口无需废话，直接扔出车外"
"0","这些人的恋爱观就离谱"
"0","我也同意这个观点"
"1","一是怕有病，万一………………二是你主动靠到高富帅我还明白，主动靠近默，还倒贴………"
"0","这是需要进化，得成千上万年呢。"
"0","没事儿你，在这儿说咱一样看"
"1","easy girl可不是国男喊的🐶"
"1","三个吧都没了，她们真废物"
"0","祖籍河南的甘肃人看过以后沉默了"
"0","这不去开个香槟?"
"1","我这都第几个号了，以前的反基少将"
"0","好多都是营销号"
"0","告诉我为什么吧主之前报警为什么把你吓成那个样子，是不是心虚。"
"0","应该发到正宗大飞柱吧"
"0","狗肉。。。？这东西平时太罕见了吧"
"1","女司机逆行，小癣女评论怪男副驾"
"0","匿名发言：我不准备隐瞒，我勇敢真诚坦率，我只是不想有麻烦。🤣"
"0","然后。。。当下身在东北。。。"
"1","你男的女的？回答全离不开“国男”两个字，这就纯粹故意引战啊"
"0","只待钉枪一声响"
"0","是我不配了吗😭😭😭"
"0","我想联系韩台男"
"0","[表情]反对的进来飞个"
"1","什么优质剩女"
"1","韦春芳是怎么做到怀孕了还不丢工作的？不会被老鸨强制打胎然后卖掉？"
"0","每人一个金钱豹红包封面，反女权吧定制，去反女权吧官方公众号“反女权主义”最近第二篇文章点开就能领"
"1","领教过东北人的坏，我只能呵呵。"
"0","下一步直接被教务处约去喝茶。"
"1","我们应该统一起来举报他，把他黑点，让他的账号不能使用"
"1","其他的都不说，为她去非洲生活点赞，別赖在中国，中国不需要黑族"
"0","你写什么了"
"1","除黑的到时也会打死你！"
"1","只要不引进，都祝福"
"0","你上过985？"
"0","太可怕了。"
"0","不怕，现在那么多考艺术的，总有人落榜的"
"1","十二生肖里没黑人"
"1","图他岁数大图他不洗澡😆图的就是两年以后你人没了房子归他"
"1","雀食男同恶心"
"1","离它远点，那家伙浑身都是病毒和狐臭"
"1","以后出门逛街遇到这种满脸都是妆的我大家伙得离远点，不知道卸完妆是什么贵物"
"1","来，给妹妹来一针"
"0","因为有相当大部分的人并不把其他地方的人当自己人"
"1","民族问题可以谈，物种问题没得谈。"
"0","工业化？农业化！"
"0","可能你的对象不对脾气吧，慢慢找能找到好的对象。你这嫖娼和谈恋爱不能等同的啊。"
"0","哈哈，厉害了我的哥！"
"1","这难道不是传说中的警察大战黑猩猩？"
"1","我寻思人长得帅的也看不上你啊⁉"
"0","前提和推理不足"
"1","这就是慕勾正常人谁和蝈蝻结婚啊"
"1","为了生混血孩子是咋想的🤔"
"0","美国就是例子，结果是零元购等等"
"1","被开除腐籍了？"
"0","经典pua"
"1","女的啊，那没事了"
"0","...最后成了程序猿..."
"0","？什么情况，答主不是男的吗？"
"0","一样的，也会"
"0","我觉得有些人在故意搞事情。这种方式很明显是美分。。。😅"
"0","不会管，终不知后事如何"
"1","喷回去，妈的，非洲人我是接受不了，在中国不干人事"
"1","极端情况指，婚后十月怀胎生了个卷发黑肤的宝宝😅"
"0","是你上来先讲一句骄傲的先富人，请问你从我的文章中怎么看出我骄傲?"
"0","可能有人觉得青海是青岛那的海吧。"
"0","你说的是你自己吧🤭"
"1","有兴趣再收复一下反同恋吧吗，那个地方已经被彻底占领了，我真是服了"
"1","喜欢黑，就一直黑下去，千万别回头，国人不接盘。"
"0","想找个黑人女朋友"
"0","现在还发文章吗"
"1","我是同性恋 从小都是 我也能理解别人对我们的不理解"
"1","哪来的通讯录怪物"
"0","直接自动排除掉了😅"
"0","没听过哪个浙江人被其实，应该说被排外"
"1","我空间加了一个号以为是发搞笑说说的结果天天打钕拳我直接把她删了"
"0","😆😆😆关键你没法背调"
"1","男的可没这么想啊，从此处可得出结论——䖡壬更恶。"
"0","确实……很有些不适，同样写过去社会的余华作品就蛮喜欢😅"
"0","现实中的男铜：比利和木吉更衣室大战耽美界的男铜：两个长得像女性的男人互相贴贴"
"0","瓜尔佳氏文鸳"
"0","评论区太和谐了"
"0","屏幕跟前我已经开始笑了，不好意思🤭"
"1","那你可说的不全面。电信诈骗祖庭是台湾，骗子口音80%台湾腔，95%南方口音。"
"0","男人不适宜的就忍受呗？男人的命也是命！"
"1","很好的解释了为什么会出现那么多eg的原因，兄弟们怎么看"
"0","哈哈哈哈，当初解放后进新疆的大多河南人甘肃人，河南人和甘肃几个地方的人名声在新疆确实不好……"
"0","🐶热搜不能没有西安，就像西方不能没有耶路撒冷"
"0","那叫一个地道！那叫一个美！那叫一个歹！百金✌Show world new 🆕😋😋"
"1","怎么哪里都有你个**"
"0","陈胜吴广揭竿而起"
"1","为什么现在女的什么离谱的要求都敢提，因为总有添构去尽力满足她"
"1","倒打一耙？ 想认真讨论的我欢迎， 想胡搅蛮缠玩文字游戏的孩子我就不奉陪了哈✌️✌️"
"1","江西也被黑啊，彩礼就算是吧"
"1","编乎有几个真的，不全是cjb"
"0","你这钓鱼钓的，直钩啊🍉"
"0","最近很着急都便秘了"
"0","是是我表达的不准确还是你读不懂？"
"1","看片都不看黑人"
"1","普信男破防实录了，属于是🤭🤭"
"1","我个人是不接受的和黑搞的女人。就算瞒着我，一旦被我知道，分手或者离婚🐶"
"0","哇你写这么多这么认真的吗"
"1","别人不能定义性少数，那同性恋有什么资格给儿童定义？"
"0","好家伙，以后不用steam，上街直接gta"
"1","时代变了，谁还偷这玩意，费劲还不挣钱，假和尚在河南才多🤣🤣🤣🤣"
"0","听说增大手术风险有点高，成则罢了，不成还不如隔了做人妖🤣。。。。求证"
"1","第二張圖無感，第一張圖真伞兵，另外男足真是不爭氣"
"0","乱真是乱真的啥？真银吗？"
"1","中国你觉得在养一个亲华的势力实际上是养了一堆白眼狼黑人很歧视华人知道嘛？"
"1","这样规定，很可能会适得其反~最终会让企业和公司那些用人单位，更加不敢招女的"
"0","你不回我我就默认了"
"0","这是什么鬼屈臣氏想玩什么"
"0","还是有敢的人的，之前看过，但是硬碰硬犯法呀！！！"
"1","不评论，不支持是因为不可能改变同性恋很恶心这种观点。既然说了就政治不正确，还不给别人不说的权利？"
"1","没救了，迟早跟巴黎一个德行！"
"1","不，黑陕西的只有河南，黑河南的可不止陕西"
"0","是的，她们正好说反了！"
"1","不要侮辱绿绿谢谢，棒子那些也就说说"
"1","txl能不能滚出反同吧，你们没有自己的吧吗？"
"1","贬低和批评中国大陆是西方国家的日常工作好吧，去看看整个东南亚那里是西方国家的的后花园！"
"0","硬碰硬？？？？国家的刑法了解下，最好做个遵纪守法的公民"
"1","我们小区里有一混血小黑 3.4岁 天天出来遛弯别的小孩都不带搭理他的"
"0","给彩礼也不嫁什么诈骗犯"
"0","我说的就是起源于非洲，有问题？"
"0","我去，有内味了"
"0","婚恋不可能平等"
"1","我是想说那他们提出的人造子宫不能解决因为需要子宫而不得不听女人的话的问题吗"
"0","日本开拓团你是只字不提啊"
"1","慕勾是这样的"
"0","当然是撑同"
"1","蝻蛆少管女人的閒事好嘛真不要臉太下頭"
"1","好像基督教徒没有童姓恋的"
"0","老打码，搞不懂"
"0","物以类聚，人以群分，你是什么样的人 ，你就会遇到什么人。和地域无关，和人心有关。"
"1","还觉得里面的功夫是真的，模仿招式，妄想学会了以后去零元购"
"1","何止，女籍也得开"
"1","防止恶性传染病人人有责，我会告诉她所有周围的人预防某传染病"
"1","黑人的头上顶着三个大字：艾滋病其他乱搞的外国人也是垃圾渣滓，怎么了？"
"1","这还不举报？？？"
"1","你发正常的帖子是钓不到同性异蛆的"
