"0","别梦了 事实就是这样。隔离你，疏远你，碍于情面不会跟你说的"
"0","我什么时候说理解就比不理解高人一等了？不要自己竖个靶子在那里打。"
"1","妓女的恋爱观而已"
"0","这不病态吧，作为一个同，我一开始也生理性厌恶。尤其是想到1和0。后来渐渐地接受了😅"
"0","B站有个叫徐云流浪中国的，你可以找他聊聊，你俩干的事差不多"
"1","说🐔不说8，文明你我他"
"0","还是吃太饱了"
"0","戳到了某些人的痛点"
"1","至于普信男，呵呵那些金针菇除了抱团取暖就没有别的本事。游艇？你让普信男变魔术还是变魔法呀"
"1","什么正经大肥猪"
"0","你说是吧春夏秋风🐶"
"0","15%左右哦，没你说的这么多"
"1","基佬会吐口水"
"0","你这样在美国是要进警察局的"
"0","神贴，可惜了"
"1","黑、黑砸，做也做不对，他们本来就不爱学习，等待镇傅照顾，做一个底层得工作"
"0","另外看看成都那边的入职增加hiv检查这一项，当然会保密，不过患者必须接受治疗，签订相关承诺"
"0","往狗群里丢一块石头。。。😆"
"1","谁告诉你女的基本上没国家概念啊。你男的娶的话你就滚出中国，女的也一样。"
"0","我拍的是GIF，但是传上来就成图片了囧"
"0","任何话都有一定道理的🤣🤣🤣"
"0","上海人形象只能想起姚明了，反面例子就是周立波啦😆"
"1","自作孽不可活"
"1","在上海务工的安徽人很多，一般对安徽有地域黑，其他身份对安徽无感，谈不上黑。🤣"
"0","个性签名亮了:向韩国人学习😓"
"1","媒体、网络有人带风向。特别是贬低中国人，媚外崇外的声音，一直有。"
"0","好家伙，你这是多重战略机遇叠加呀"
"1","东北人真的很讨厌阿"
"1","劲夫们打她"
"0","同室内伐贻笑外人"
"1","体制内的打拳的最多了，优越感很多很强的"
"1","当然是男的多。戴贞操带的男的比女的多十几倍。"
"1","。。虽然我对这个答案也挺迷惑但是基佬就没工作就不能有工程师了？?"
"0","当成女权来侮辱"
"1","真是搞不懂这种人怎么就那么想当默的配种母狗，活该"
"0","东北在山东之前"
"1","昨晚上在南山壹华里就看见一个女大学生和一个默在一起，真太不知廉耻了！"
"0","现在互联网上男性对这张图的评价是打情骂俏，那就让我们再过5年后看看吧，若还是那德行，可能真没救了"
"1","2.好玩。非处在性方面懂的比处女多，也比处女放得开，更熟练或更乐意学各种不同姿势和玩法。一个字：爽"
"1","别买，这是设计给黑人穿的"
"1","大家知道怎么让人没法关注我吗？有个叫蒋仁贵的黑咋种老是要关注我，也是无语了！"
"1","你就别幻想了，刘某，你只是个奇趣蛋。"
"0","快来水！快来水！"
"0","你是全国人？"
"0","什么叫新疆人？维吾尔族？"
"0","那她得不介绍她的社会关系。"
"0","就这么个点刑期？"
"1","这不正是你们这帮lj的写照吗？自己不接受的事物就要怱悠别人都来反对，还自以为很正义～"
"0","是友军，但是没有加狗头，厚葬"
"1","我国不禁止种族歧视，没事的，大胆说出来就行！你是不是种族歧视！我们热爱祖国，但是我们讨厌黑人！"
"0","我国2018年的书看看同性恋是不是要治疗。"
"1","黑河南、黑北方的都是南满"
"0","我去，我无法用语言评价了都"
"0","如果真有人工子宫，那地很贵吧"
"0","性方面也是比不了的"
"0","数字化指网络巨人现实侏儒"
"0","大家都没去冲没"
"1","河南新疆回族人。。。。。。。。就真的没有一点办法了，，，3头不是人。。。哈哈哈哈哈"
"0","太真实了。这个才像是真正在现实生活中经历过的人。"
"0","这货改名了？"
"0","这女的还算识趣"
"1","所以我并不认为第三帝国有错😏"
"0","你在这里问什么问"
"1","网上喷黑喷同胞的成万上亿，现实中敢和黑人硬碰硬的寥寥无几，看来还是上网喷同胞安全又不犯法😆"
"0","偷窥者，这女的懂我意思吧"
"0","还有离婚律师就离谱"
"1","xswl，怎么你家人均资产上亿？仇富？你也配？"
"0","为什么不能穿？"
"0","说什么呢？上海苏北人还不多？"
"0","这地方在全国是出了名的"
"0","别埋在心里，应该说出来让配偶见贤思齐，还能抬高身价。"
"0","本来想骂你的，结果一看我擦，姜太公钓鱼😠"
"1","相信我那个女人脑子不正常👍️中国还是有很多脑子正常的女人的👍️👍️👍️"
"0","又是动物袭击人类"
"1","知足吧，爱丁堡不比井盖、山越猴、京巴、九头鸟、东百太君、白完、胡建、陕蛋蛋、响马听起来洋气？"
"0","看病不去跟容易复发啊"
"0","都是发泄怒气罢了"
"1","对啊我个人就抵制男同了咋滴啦"
"0","讨好女性是吧，我下次买***"
"1","我对中国女性确实有看法，在外面待久了，你就知道外国人是怎么看中国女性的了。"
"0","甜上加甜?(虽然我精神洁癖对性敬而远之)"
"0","看到谁也逃不了，感觉好受多了。"
"1","一位优秀的接盘侠👍👍"
"0","我研究两性关系很久了，钓鱼有意义吗，我只是想让大家消除偏见而已"
"0","匿名作者不回复了🤣🤣🤣"
"0","实战经验丰富"
"1","这不就是皮条客吗"
"0","同情+保护🤣🤣🤣"
"0","但她害起当地的中国人，工作中暗中搞鬼，被辞退了破坏中国公司在当地的商业进展不会手软。"
"1","反同方会思考，撑同方不会思考，看看只有撑同方相信p图造谣我有艾，这只会让人觉得基佬都是脑子有毛病"
"1","同性恋有害健康，吃狗肉有益健康，禁止同性恋，支持吃狗肉！"
"0","有毛病，还噶黑呢😓"
"1","我草，怎么我说话就直接删"
"0","唐朝前期的公主外嫁和后面的五胡乱华有很大关系哟"
"0","我啥时候说河南人偷井盖被歧视？"
"1","丰县丢尽了江苏的脸，丰县是苏北的不？你不会说丰县是山东的吧🤣"
"1","堕落的媚黑奴，就算我比黑人厉害无数，我也不帮媚黑奴。这就是报应！"
"1","七尺大儒猴简介"
"1","学一口东北话去上海工作吧"
"0","那你尊重提问者说的话吧"
"0","有100多万个小偷骗子？"
"1","男性被害一般上不了微博热搜，女性被害才有更高的流量，媒体热衷于报道。"
"1","现在辩证的来看小胡子错就错在输了战争"
"1","别，黑的血肉我想想都恶心"
"1","其实广西都是外地人在搞传销，结果广西居然自己也认了，现在官方发声明也不管用了，人不信了"
"0","工资卡看好"
"0","潮汕火锅太养生了吧"
"1","没素质就是没素质。离开屏幕都是陌路人。网络上想表述观点还是要有点人样。"
"1","这只是猩猩同类之间的交配而已"
"1","啧啧，现在只要在网上说同性恋一点不，就要被喷的连渣都不剩"
"0","我工作时被河南信阳女客户的素质大跌眼镜。。无语住了。"
"0","呵呵我没食欲的时候就真想吃这个米饭喔，印度菜更加是我的最爱，你是南方人吗吃东西很清淡？"
"0","有些人啊，就是自己都没活明白，却天天要求别人，你有那闲心管管你自己好不好"
"1","就算她不拿刀你就能打得过180斤起步的母坦克?"
"0","有些男的不也这样？这很正常啊"
"0","这种你能忍就忍呗，放我身上开始都不会有"
"0","有失足风味的火锅么"
"0","有这样的话？如果是这样的，那就是卫辉官媒的错误。但是，你是不是在造谣。请给出网址以供查阅。"
"0","看不下去了！"
"1","这就是批判婚姻制度的♀⭕️"
"1","有些男的女的看不上⁉为什么会觉得男同看得上自己🤭"
"0","女权吧不一定"
"1","我一直在鼓励国男外娶或者不婚，去规避越来越高的接国际盘的风险，我担心个啥🤣"
"1","垃圾：黑同，同意的顶。颠覆国人的三观，棒垃圾当宝贝。"
"1","哈哈哈哈nb造的"
"0","我之前还真见过，一家人，带着俩小孩来吃麦当劳，就坐我旁边，当时我就感叹这女的真有本事😆"
"0","当时那个清华腚后面看监控也反转了，所以别去信小作文"
"0","华工被法国女孩喜爱这件事你是怎么说服自己相信的"
"1","爱上同性后悔莫及"
"1","🐶要是以后我女儿这样我还真会，并且会反思自己为什么教出伞兵"
"1","实话实说，这些男人也太怂了"
"0","不结婚就完事"
"1","咱们就长话短说，图片里的这个吧，大家小心点，是个撑同吧！不是反同吧！请各位注意！注意！注意！"
"1","请去动物园"
"0","黑小妞在餐厅厨房准备尼日利亚大菜，熏火鸡配以菠菜、甘蓝、洋葱、辣椒杂炖。"
"0","又一篇科学家的搪塞文章"
"0","比黄人好看多了，真养眼。"
"1","怎么样，人家现在露出猩猩面目了，你往世卫投钱，整天捐款，现在白打水漂了"
"0","披上理中客外衣"
"0","只希望能多接受我们罢了。"
"0","这话说的，好人就该被枪指着。骗人的不管被骗的有罪✌️"
"1","好起来了，兄弟们，女人也开始反感女拳了。"
"0","你跟这种人说不清楚，不如省点流量😅"
"1","就是可以对着蟑螂女仆冲一波的人"
"1","我都要吐了真的很会玩"
"1","楼主说的那种东西真是不言而喻当然指的就是虫族"
"1","看头像还是个ltp基佬，真不嫌磕碜，恶心。"
"1","从某种意义上来讲，在座各位都要感谢杨笠，她把大部分小仙女心声说了出来"
"1","它就是个精神有问题的费五"
"0","很简单这个事，出台法律只有中国男人的孩子才有中国国籍，中国女人和外国人生的没有中国籍。直接解决问题"
"1","哈哈哈哈哈哈哈，笑死了红毛鬼子，我感觉问主就是来钓鱼的"
"1","能不能去微博和豆瓣打啊老哥们，把这毒瘤除了行不行"
"1","莆田系医院难道不是骗？哦，莆田系医院不是骗，是杀人，莆田鞋难道不是假？"
"1","这人老挠弹了，之前就被人举报封过，大过年又出来发病了"
"1","她们有找黑人的自由，我也有不接受她们作女友的自由呀。"
"0","没办法，这些女的只喜欢钱，她们可对嘻哈不感兴趣"
"0","所以啊这话根本不是韦小宝说的，而是金庸说的这意思就很明确了"
"0","可以拉一下我"
"1","额，你不会以为同看到你就会疯狂的爱上你吧，有点自知之明行不行"
"0","优越感说的可不就是你～"
"1","_xDC36__xD83D_zz有空发这个不如去舔你默🐶的嘿d"
"0","你把埃及科普特人放到哪去了？"
"0","。。。吧主啊，必须尽快有，省得有人天天发垃圾贴，比如那个天天投票贴什么的"
"1","把个人资料公开下以后男性司机全部拉黑她就行了"
"1","非洲有没有什么划时代的产品？有啊，奥密克戎和艾滋病"
"0","非常棒，做好了估计能像安提赫蒙一样出精品"
"1","从小这个基佬就N待小动物，果然是变太"
"1","哎，这智商，这水平，义务教育也不知道是怎么混过去的。。。。。。。"
"0","敢问钉枪何时响！"
"1","老乡，井盖要吗？一个大胡子满脸堆笑看着你。"
"1","既得利益者可真是笑死我了，得利的也就少数上流社会，底层打工人过得还不如卖啤的女的"
"1","这样的行为真的是欠揍熊孩子行为。"
"0","看到你这个，我觉得好可怕"
"0","河南官方认证"
"1","国女来了😆"
"1","😭井盖好沉的，根本就不好偷啊😅就这一个黑了多少年了，河南的假和尚可比偷井盖的多多了"
"0","只能说罪有应得"
"0","你可以自己恶心 但是不能指着他（她）的鼻子说恶心 我就是我所谓的三观"
"0","你们是从哪里看到的这些新闻啊，我从来都没刷到过😅"
"0","不是说出国了吗？我在手机上搜 吴施蒙 竟然出来一堆色情网站，哈哈哈"
"0","很明显火星人是人好吧？火星人名字都带人字了，选错的自己反省"
"1","泼峰是一名猪种反同部队退役反同战士。"
"1","哎，奈何默数量越来越多好多。"
"0","难道犯罪率不是社会状况的重要参考标准吗？"
"0","直接主动攻击，杀疯了"
"1","黑人要在中国呆，就得把皮拔了，染成黄色的"
"0","你要考虑一下是不是上梁不正下梁歪。"
"1","这女的绝对不无辜！"
"1","B站女拳，说着说着自己玻璃心把我拉黑了"
"0","哪里都有好坏人，按地图分辨的非蠢即坏"
"0","黑人能发明啥"
"0","你看你的网名叫春夏秋冬，我把你叫春夏知了，你同意吗？"
"0","我是黑人，我爱中国女孩…"
"0","有吗⁉咋感觉没看见几个夸黑人的媒体呀（礼貌询问）"
"1","骂南方人马来猴子的，都是瑞典和族混血老铁。"
"0","麻烦你把广告叉叉掉"
"1","那你观察得不够了。厦门是被地域黑最严重的地方之一，原罪就是因为城市核心区在岛上"
"1","黑人有啥资格在别人家里要求这家的主人必须对他好"
"0","不犯法就行了"
"0","你不会真以为我是小号了吧，没见度度都不说话了吗"
"0","就抓着这点输出⁉非得把我指待的群体扩大化"
"0","好久没上贴吧了，广黑吧没了吗？"
"0","其实谁不是呢"
"0","你知道混了多少代才滚到这种能看见五官的肤色吗？至少上百年了"
"1","我也是。我及其厌恶黑皮。与其为伍就是自甘堕落😅😅"
"0","哥们我支持你，好女人值得珍惜，既然他欺骗你在先，那就没必要有负罪感！"
"1","这种低智商的女人多出去点才好，千万不要再回来了，不然会拉低整个民族的平均智商"
"1","石砸狗叫了属于是"
"0","不知道怎么说带个娃找下家本身是很难的何必迁怒"
"0","说实话男性也可能得这个病"
"1","归根究底，广大普通女性若是靠近普信男，会不幸。这是最正确的结论。"
"1","这帮b，艹"
"1","先有福利再有蹭，饭菜放外面一定会招苍蝇。苍蝇让人恶心不假，但是是谁把饭菜放外面的🤔"
"1","你是gay？"
"0","抢占市场外销便宜"
"1","女性多数感性思维容易洗脑"
"0","没本事了，溜了"
"1","作为四川人，感觉受到的歧视也不少。"
"0","？？？为什么不能？"
"0","别梦了 事实就是这样"
"0","如果有人问如何评价，我评价建议去微博而不是来贴吧"
"0","民族团结大过天"
"0","说得很对！赞！很中肯的评价"
"0","我也很浪漫很会说话啊。一擦我得擦。"
"0","谁是敌人，谁是朋友是革命的首要问题。"
"0","全国都知道一句上海名言“安啦上海银。。。。。你们。。。”😆"
"1","女拳师们速来挨骂😆😆"
"1","老黑一直都是边说人家歧视他边做伤天害理的事。"
"1","你应该学习一下生物学和遗传学，然后研究一下黑人的劣质基因，并进一步找到黑人低智商和野蛮的根本原因。"
"1","Acquiescent HIV carrier🍉"
"0","度度拿不出我是小号的证据只能转进，转进两次都被我打脸打回来了，也是够窝囊的"
"1","部分地区穷吧，我说的不开化这一点"
"1","要不您证明下您是人？😆"
"1","黑人自己放弃了自己，怨不得别人。"
"0","我还是觉得保加利亚妖王顺眼多了"
"1","那就嫁过去呗去非洲 不要让中国出现黑二代黑三代"
"0","虽然但是我好喜欢广c人说话"
"1","这种东西还以为zg是非洲吗？"
"1","看网站的时候多看看国产，说不定能看到你女朋友"
"1","引进黑人首先感染性病的几率会大幅度上升，还有出轨家暴x虐待的概率上升，其他没有任何的好处"
"0","这个贴吧据我所知它已经p了3个人的图了。我倒要看看他还要再p哪些人的图"
"0","黑人农奴都卖去美洲，法国本来农民就够"
"1","不是哈尔滨毅腾打辽宁女球迷的时候了？打完还抢包？"
"0","图都绿了会不会截图啊"
"0","北东北，南广西"
"0","本来就要征服，哪有靠舔的"
"0","""恶性踢裆犯规，这种人就应该永久禁赛""""格斗""""ufc""""ONE冠军赛"
"1","把女人关起来当生育工具啊，恶心死人。这种又蠢又贱的生物根本不配把她当人看。"
"0","搞笑。你家里有，那不是你用？"
"1","太棒了，支持你，什么时候介绍你老婆我认识一下"
"1","第一次看见反自己民族主义的，厉害厉害。"
"1","看了就说我们流氓，不看就说我们是gay、xing冷淡。还不知道你怎么想的？"
"1","管她们呢，让她们和劫匪一起死不好吗？"
"0","不知道吧里真正懂太乙神数和奇门遁甲和大六壬的大神还有多少"
"1","都是些没人要的钼刃在网上翻天覆地"
"0","追时不择手段，达到目的，就不一样了"
"0","按常住来算，新上海人也算进去吧🤣"
"0","这个还是小心吧。"
"1","这个很难得，只要基佬不说谁都不知道他是基佬"
"0","三四十万是卖女儿吗？"
"1","大多黑人都是入赘的"
"1","在上海，当地的大爷大妈会时时刻刻提醒你是乡下拧🤭"
"0","事实证明有些男人可以分分钟有游艇，为什么有些却不行？"
"0","盗别人照片"
"0","钱别瞎花，买资产，买能提供稳定现金流的资产，买能买到的核心资产，价格合适就使劲买"
"1","在这事上真应该参考日本的做法，限制黑人进入国门，真不知道引黑人来中国到底有什么贡献"
"0","看到这种新闻真高兴"
"1","四川媒体黑其他地方也不少"
"0","我他玛就是歧视他们。表现不好就要有受人歧视的觉悟"
"1","缴尼玛，打！"
"1","永远不要对钕刃仁慈"
"0","也确实有很多女的会买耳机啊有问题吗？男的女的都有"
"0","麻烦你下回举证用：江桥抗战，国际公认反法西斯战争第一枪！"
"1","如果说要反对嘿人留在中国，必须真实点赞率必须超过4.7亿人，也就是总人口的1/3以上！！！"
"0","冷处理，直接借机大闹一通，然后出去上网"
"0","虽然不知是真是假，但感觉很牛逼"
"1","这人还是个op"
"1","中国尺寸是真的小"
"1","艾滋病率高，死的快"
"0","希望你能为本吧带来更多正能量，尤为感谢"
"1","中国一女生被黑人当街指着鼻子骂，而她乖的连话都不敢说"
"1","前因后果不做讨论，谁知道是不是你嘴欠找事，全程录像，请"
"0","还在吹这个计划😅"
"0","芜湖起飞！"
"0","为什么不用标点符号"
"0","诸位如何评价？关注微信公众号-反接盘联盟"
"1","看点新闻就狗叫"
"0","最近钓鱼越来越没水平了😆"
"0","哥们，恭喜你勾搭个妹娃儿😆"
"1","去黑非洲就行，那里有酋长"
"1","经典各打五十大板了，再扣个狗的帽子，很难不典😓"
"0","我河南人，外婆家辽宁，这两年沈阳大连城市发展已经开始落后了"
"0","应该不是因为这个，应该是因为某些观念"
"0","有些人，你尊重他，他会得寸进尺"
"1","在王者开个变声器打打辅助取个软甜仙女名，舔狗和米分分钟来，数麻了"
"1","哈哈息肉梅毒，过于真实"
"1","宁可认滤了几代的旧宫家养子,也不认可血统纯正的女性为皇族继承人"
"0","高密无辜养奸佞😆"
"0","化学姐改名了"
"0","别什么苏南浙北上海，具体点，上海大都市圈，一开始上海苏州无锡南通宁波嘉兴舟山，后来加入常州湖州"
"0","强迫喵喵喵？？"
"0","不要，基本上被污染了"
"0","玩消失啊，艾就一个滋😆"
"0","没对媳妇吼过，不礼貌！"
"0","没这18w，你这说话的口气再好也没用"
"1","快乐教育的产物😓生怕我们不知道她们是圣母，还有他们那些极端动物环境保护组织的人 一群玛利亚"
"0","蛀虫？都是好好生活、工作、交税的。怎么就蛀虫？"
"0","我在南京 师妹师姐都是黑龙江的 我辽宁的 我们总一起去吃东北酸菜，离开东北还是东三省认最亲近。"
"0","对比图片？"
"0","我们大连总背说属于山东，其实我们是辽宁的东北的"
"1","非我族类🤣！"
"0","归根结底你还不是觉得两个人在一起是为了生育嘛"
"0","不好意思 我就是詹姆斯的球迷"
"0","那你还在上海吗？"
"1","让她生下来，在分，不要说残忍，女人背着你跟别人的时候从不想这些。"
"0","日本民族南迁江苏大融合😢被侵略了就用大融合自我安慰，和汪精卫有什么区别？"
"1","知乎好多黑人和中国女人在一起的图片能把你看吐"
"1","杀光女权，一个不留！"
"0","这样喊是觉醒的标志"
"1","我承认我是一个有着种族歧视的人，我只喜欢黄种人🤔🤔"
"0","这是恶意骚扰啊"
"1","我的治疗力大所以30天。百度是想基佬越来越少，没有反同人士的救援，基佬染艾身亡就会越来越多。"
"0","而带着孩子的女人就不能有？？？"
"0","兄终弟及， 父终子及"
"1","希望反同恋吧越来越好"
"0","也没这个必要无差别攻击吧。。。"
"0","中秋快乐！"
"1","这时候没人说黑人也有好人和坏人了"
"1","抢劫也很猛吧。"
"1","什么上海？那不是叫爱丁堡吗？"
"0","恩！生孩子都不用去医院！"
"1","buff最高的是东北满朝俄混血"
"1","🐮人口多嘛 不过很多把潮汕当靶子 也有把潮汕切割出去的🤣"
"0","让你上去洗个澡再走"
"0","所以另外一个房客是本地人还是外地人?"
"1","如果黑人多了，一定闹分裂了"
"0","原来约架这样的事儿从好几年前就开始了。网上说的兴冲冲的结果把人忽悠到约定地点自己倒还在家躺着吹空调"
"0","行了行了，知道你反串，水够了就得了"
"0","钻石这种东西的价格全是炒出来的别人工业用钻就是那这玩意切东西的"
"1","女人越老越贬值，越老越不能生，这是事实吧？有的女权要问了，我为什么非要生孩子，问得好"
"0","不愧是金庸先生，思想先进👍️"
"0","论惨天津还轮不上号，比如都喊上海租界，你看见几个喊天津租界的，天津租界面积比上海还大呢😅"
"1","彩礼吧本来就是农村小仙女聚集地"
"0","对策：男人不婚"
"1","而且生孩子跟这能一样么，不是两种感觉？怎么不让女的试试电击，看看生孩子和电击是一样的不"
"0","备注：本人于今天上午一点发的同名帖子被系统删除，删前已有100多评论。大家猜猜是怎么回事呢"
"1","我江西同事私下都说绝不找本地的，除非没得选"
"0","个人肯定没办法对他们好，但是从法律上来讲的话确实没办法"
"1","那要知道这些女人男人塑造的，不过是男人怕其他男人变成舔狗罢了"
"1","什么女用洗衣机，这就把我的臭袜子塞进去"
"1","其实互相尊重就好了，我们允许你们同性恋的存在，但也允许我们有些异性恋接受不了！这是生理上抗拒的！"
"1","再一个，眼睛不要的话，这边建议您捐出去呢"
"1","嫁鸡随鸡，嫁狗随狗，嫁三儿随三儿咯🤣🤣"
"0","人又帅又高"
"0","有内部汉奸，故意的"
"0","而且视频中对其他异性恋企鹅的描述也显示其别有用心"
"1","幕刃欠凌迟"
"0","吃喝嫖，全包"
"1","北方人眼里，广东南蛮之夷。"
"1","说的对，普信男都是这样低下"
"0","对啊，为什么呢"
"1","被娘服封肛了开始用精神宣布胜利✌"
"1","如果真的是男的，则废物测试没通过"
"0","你要相信自己是人，只有动物才会被自己的欲望操纵，对自己有信心"
"1","都他妈是一个中国人，黑哪里都是黑自己"
"1","北京上海400分上清北了解下"
"0","剃头了，剃头了。"
"1","说起地域黑就不得不提河南省"
"1","想反女权还得看女权，舔狗龟男理中客们不是男人能打醒的"
"0","不要随便用自己不知道怎么用的东西喔更别拿出来卖弄，容易出丑的"
"1","不结婚。但喜欢跟黑人做。😅😅"
"1","白左真可怕"
"0","樓主是老闆嗎"
"0","万分之九？这么高的吗？我这十几万人的小镇，按比例有100人？不寒而栗啊😱"
"0","怂了又不甘心，真有意思🤣"
"0","这是墨斗鱼"
"0","千年乌龟万年王八"
"1","谁惹你们了，你们骂谁去，非要咬着整个江西不放？"
"0","娇滴滴说的是江南女生,广东那边，肯定不会那么黑的,会进行一些什么向猴之类的"
"1","你把生活区ban了就不会碰见女👊了"
"1","谁闲着无聊黑江浙啊。。。。。不是一直沪黑全国么"
"0","改变之后应该是变成双吧"
"0","...过得还算不错，无须重开"
"1","你马上要被打成上海人了"
"1","舔狗赶紧去死吧"
"0","自己人抓自己人啊？"
"1","转而录用你一个下水道老鼠吗，开玩笑呢吧"
"1","13襄金边了是吧？"
"0","又被删了，发着吧"
"1","哈哈，吃饱狗肉就溜了？"
"0","她们知道自己比男的早退休5年，寿命比晚退的男人多活10几年，比男人多领20多年退休金她们知道吗。"
"0","孔子曰：耳听为虚，眼见为实！！！"
